ID,信息源,大类,子类,URL,标题,摘要,发布日期,采集时间,哈希
47936,PR Newswire,投融资与生态,PR新闻通讯社,http://www.prnewswire.com/news-releases/autoliv-and-rs-taichi-partner-to-advance-motorcycle-rider-protection-with-an-airbag-vest-302723034.html,"Mar 24, 2026, 03:23 ETAutoliv and RS Taichi Partner to Advance Motorcycle Rider Protection with an Airbag VestAutoliv, Inc. (NYSE: ALV) (SSE: ALIVsdb) has developed its first complete wearable protection for motorcycle riders: a vest with an integrated airbag ...","Autoliv, Inc. (NYSE: ALV) (SSE: ALIVsdb) has developed its first complete wearable protection for motorcycle riders: a vest with an integrated airbag ...",,2026-03-26T08:05:34.984809,afc15a6eff8b2f218b4fde250871ea8a
47937,PR Newswire,投融资与生态,PR新闻通讯社,http://www.prnewswire.com/news-releases/autoliv-and-rs-taichi-partner-to-advance-motorcycle-rider-protection-with-an-airbag-vest-302723031.html,"Mar 24, 2026, 03:20 ETAutoliv and RS Taichi Partner to Advance Motorcycle Rider Protection with an Airbag VestAutoliv, Inc. (NYSE: ALV) (SSE: ALIVsdb) has developed its first complete wearable protection for motorcycle riders: a vest with an integrated airbag ...","Autoliv, Inc. (NYSE: ALV) (SSE: ALIVsdb) has developed its first complete wearable protection for motorcycle riders: a vest with an integrated airbag ...",,2026-03-26T08:05:34.984809,df57b4483de863b179cfaf6d39fba73b
47938,PR Newswire,投融资与生态,PR新闻通讯社,http://www.prnewswire.com/news-releases/ti-unveils-high-performance-isolated-power-modules-to-advance-power-density-in-data-centers-and-evs-302720298.html,"Mar 23, 2026, 09:00 ETTI unveils high-performance isolated power modules to advance power density in data centers and EVsTexas Instruments (TI) today unveiled new isolated power modules, helping enable increased power density, efficiency and safety in applications...","Texas Instruments (TI) today unveiled new isolated power modules, helping enable increased power density, efficiency and safety in applications...",,2026-03-26T08:05:34.984809,304434fac2f0d3416aced6e2524c992f
47939,PR Newswire,投融资与生态,PR新闻通讯社,http://www.prnewswire.com/news-releases/hexagon-publishes-the-annual-report-and-sustainability-report-2025-302721830.html,"Mar 23, 2026, 03:15 ETHexagon publishes the Annual Report and Sustainability Report 2025Hexagon's Annual and Sustainability Report 2025 is now available at Hexagon's website hexagon.com. Hexagon intends to solely distribute the report...",Hexagon's Annual and Sustainability Report 2025 is now available at Hexagon's website hexagon.com. Hexagon intends to solely distribute the report...,,2026-03-26T08:05:34.984809,7c9da1f606abe231789328b9a3bdca53
47940,PR Newswire,投融资与生态,PR新闻通讯社,http://www.prnewswire.com/news-releases/discover-the-future-of-automotive-manufacturing-technology-in-amts-2026-shanghai-china---register-now-for-free-pass-302719726.html,"Mar 22, 2026, 20:00 ETDiscover the Future of Automotive Manufacturing Technology in AMTS 2026, Shanghai, China - Register Now for Free PassAMTS (Shanghai International Automotive Manufacturing Technology & Materials Show) is the leading one-stop platform showcasing the latest...",AMTS (Shanghai International Automotive Manufacturing Technology & Materials Show) is the leading one-stop platform showcasing the latest...,,2026-03-26T08:05:34.984809,290da011b0400fca44fe0eae43906600
47941,PR Newswire,投融资与生态,PR新闻通讯社,http://www.prnewswire.com/news-releases/xgrids-auf-der-nvidia-gtc-2026-real2sim-schlagt-die-brucke-zwischen-realen-raumen-und-physischer-ki-302721395.html,"Mar 21, 2026, 12:10 ETXGRIDS auf der NVIDIA GTC 2026: Real2Sim schlägt die Brücke zwischen realen Räumen und physischer KIDamit Roboter in der realen Welt zuverlässig arbeiten können, müssen sie in Umgebungen trainiert werden, die diese präzise abbilden. Genau das ist...","Damit Roboter in der realen Welt zuverlässig arbeiten können, müssen sie in Umgebungen trainiert werden, die diese präzise abbilden. Genau das ist...",,2026-03-26T08:05:34.984809,6fdcaae62179f59aa95b442189740ffc
47942,PR Newswire,投融资与生态,PR新闻通讯社,http://www.prnewswire.com/news-releases/xgrids-en-nvidia-gtc-2026-conectando-espacios-del-mundo-real-e-ia-fisica-a-traves-de-real2sim-302720227.html,"Mar 20, 2026, 17:45 ETXGRIDS en NVIDIA GTC 2026: Conectando espacios del mundo real e IA física a través de Real2SimPara que los robots funcionen de forma fiable en el mundo real, deben entrenarse en entornos que lo representen con precisión. Este es el principal...","Para que los robots funcionen de forma fiable en el mundo real, deben entrenarse en entornos que lo representen con precisión. Este es el principal...",,2026-03-26T08:05:34.984809,648bd5b2b0911edb00f20c7aa04974ef
47943,PR Newswire,投融资与生态,PR新闻通讯社,https://www.prnewswire.com/news-releases/heavy-industry-manufacturing-latest-news/,"Feb 01, 2024, 06:45 ETInternational Paper Reports Full-Year and Fourth Quarter 2023 Results","MEMPHIS, Tenn., Feb. 1, 2024 /PRNewswire/ -- International Paper (NYSE: IP) today reported full-year and fourth quarter 2023 financial results. FULL-YEAR AND FOURTH QUARTER 2023 HIGHLIGHTS Full-year..",,2026-03-26T08:05:34.984809,326c92d01369ca0d74870790e1fa375b
47949,PR Newswire,投融资与生态,PR新闻通讯社,https://www.prnewswire.com/news-releases/telecommunications-latest-news/,"Feb 25, 2026, 02:00 ETTECNO Unveils the World's Thinnest Modular Smartphone Ecosystem Concept","A new ultra-thin magnetic architecture makes a modular smartphone system possible without added bulk. HONG KONG, Feb. 25, 2026 /PRNewswire/ -- AI-driven innovative technology brand TECNO is set to...",,2026-03-26T08:05:34.984809,95102af8c33d94eef2d61981852689b8
47955,PR Newswire,投融资与生态,PR新闻通讯社,https://www.prnewswire.com/news-releases/consumer-technology-latest-news/,"Feb 25, 2026, 02:00 ETTECNO Unveils the World's Thinnest Modular Smartphone Ecosystem Concept","A new ultra-thin magnetic architecture makes a modular smartphone system possible without added bulk. HONG KONG, Feb. 25, 2026 /PRNewswire/ -- AI-driven innovative technology brand TECNO is set to...",,2026-03-26T08:05:34.984809,3a98df257d1dfd72a2dad0a6f05e4694
47961,PR Newswire,投融资与生态,PR新闻通讯社,https://www.prnewswire.com/news-releases/clarivate-reveals-the-ai50--the-organizations-leading-artificial-intelligence-invention-302725393.html,"04:00 ETClarivate Reveals the AI50 - the Organizations Leading Artificial Intelligence InventionClarivate Plc (NYSE:CLVT), a leading global provider of transformative intelligence, today announced the Clarivate AI50, a new data-driven benchmark...","Clarivate Plc (NYSE:CLVT), a leading global provider of transformative intelligence, today announced the Clarivate AI50, a new data-driven benchmark...",,2026-03-26T08:05:34.984809,6a6de124dc577aad05d88681b80ed817
47962,PR Newswire,投融资与生态,PR新闻通讯社,https://www.prnewswire.com/news-releases/durabook-prasentiert-die-z14i-hg-erste-ki-fahige-rugged-mobile-workstation-mit-einer-ki-leistung-von-bis-zu-682-tops-302719756.html,"04:00 ETDURABOOK präsentiert die Z14I-HG: Erste KI-fähige Rugged Mobile Workstation mit einer KI-Leistung von bis zu 682 TOPSMit der neuen Z14I-HG stellt Durabook, weltweit renommierte Marke für widerstandsfähige Mobilitätslösungen und Teil der Twinhead International...","Mit der neuen Z14I-HG stellt Durabook, weltweit renommierte Marke für widerstandsfähige Mobilitätslösungen und Teil der Twinhead International...",,2026-03-26T08:05:34.984809,deabc74a37deea574443ba20f9fdeef4
47963,PR Newswire,投融资与生态,PR新闻通讯社,https://www.prnewswire.com/news-releases/durabook-launches-z14i-hg-the-worlds-first-ai-ready-fully-rugged-mobile-workstation-delivering-ai-performance-up-to-682-tops-302719692.html,"04:00 ETDURABOOK Launches Z14I-HG: The World's first AI-ready Fully Rugged Mobile Workstation Delivering AI Performance up to 682 TOPSDurabook, the global rugged mobile solutions brand owned by Twinhead International Corporation, today announced the launch of its new Z14I-HG fully...","Durabook, the global rugged mobile solutions brand owned by Twinhead International Corporation, today announced the launch of its new Z14I-HG fully...",,2026-03-26T08:05:34.984809,a5c9b3bd0b0e8ce32bf478525b353450
47964,PR Newswire,投融资与生态,PR新闻通讯社,https://www.prnewswire.com/news-releases/durabook-lanza-el-z14i-hg-la-primera-estacion-de-trabajo-movil-rugerizada-con-ia-de-hasta-682-tops-302719771.html,"04:00 ETDURABOOK lanza el Z14I-HG: la primera estación de trabajo móvil rugerizada con IA de hasta 682 TOPSDurabook, la marca global de soluciones móviles rugerizadas propiedad de Twinhead International Corporation, anunció hoy el lanzamiento de su nueva...","Durabook, la marca global de soluciones móviles rugerizadas propiedad de Twinhead International Corporation, anunció hoy el lanzamiento de su nueva...",,2026-03-26T08:05:34.984809,24e942dea76f18f17f966e330cf7f9f5
47965,PR Newswire,投融资与生态,PR新闻通讯社,https://www.prnewswire.com/news-releases/f5-elevates-to-gold-membership-in-the-cloud-native-computing-foundation-302725178.html,"04:00 ETF5 Elevates to Gold Membership in the Cloud Native Computing FoundationThe Cloud Native Computing Foundation® (CNCF®), which builds sustainable ecosystems for cloud native software, today announced that F5 has upgraded...","The Cloud Native Computing Foundation® (CNCF®), which builds sustainable ecosystems for cloud native software, today announced that F5 has upgraded...",,2026-03-26T08:05:34.984809,bca724fd94db3433bd604d8a878fe5b9
47966,PR Newswire,投融资与生态,PR新闻通讯社,https://www.prnewswire.com/news-releases/durabook-lance-le-z14i-hg--la-premiere-station-de-travail-mobile-entierement-durcie-prete-pour-lia-au-monde-offrant-des-performances-ia-allant-jusqua-682-tops-302719738.html,"04:00 ETDURABOOK lance le Z14I-HG : la première station de travail mobile entièrement durcie prête pour l'IA au monde, offrant des performances IA allant jusqu'à 682 TOPSDurabook, la marque mondiale de solutions mobiles durcies appartenant à Twinhead International Corporation, annonce aujourd'hui le","Durabook, la marque mondiale de solutions mobiles durcies appartenant à Twinhead International Corporation, annonce aujourd'hui le lancement de sa...",,2026-03-26T08:05:34.984809,0d8378d561d3ca632f39f6bff0a59593
47967,PR Newswire,投融资与生态,PR新闻通讯社,https://www.prnewswire.com/news-releases/rockwell-automation-showcases-autonomous-industrial-operations-at-hannover-messe-2026-302720132.html,"04:00 ETRockwell Automation Showcases Autonomous Industrial Operations at Hannover Messe 2026Rockwell Automation, the world's largest company dedicated to industrial automation and digital transformation, today announced its presence at...","Rockwell Automation, the world's largest company dedicated to industrial automation and digital transformation, today announced its presence at...",,2026-03-26T08:05:34.984809,c740cb152483db86ffff82a021e82733
47968,PR Newswire,投融资与生态,PR新闻通讯社,https://www.prnewswire.com/news-releases/a-moment-of-indulgence-risala-captivates-with-kefi-latte-at-cosmoprof-bologna-302725822.html,"03:59 ETA Moment of Indulgence: Risala Captivates with Kefi Latte at Cosmoprof BolognaAt Cosmoprof Bologna, Risala arrived with undeniable momentum. The booth remained in constant motion, drawing in global distributors, influential...","At Cosmoprof Bologna, Risala arrived with undeniable momentum. The booth remained in constant motion, drawing in global distributors, influential...",,2026-03-26T08:05:34.984809,fac44d1ea2b4186e9da2098031bba807
47969,PR Newswire,投融资与生态,PR新闻通讯社,https://www.prnewswire.com/news-releases/a-moment-of-indulgence-risala-captivates-with-kefi-latte-at-cosmoprof-bologna-302725828.html,"03:59 ETA Moment of Indulgence: Risala Captivates with Kefi Latte at Cosmoprof BolognaAt Cosmoprof Bologna, Risala arrived with undeniable momentum. The booth remained in constant motion, drawing in global distributors, influential...","At Cosmoprof Bologna, Risala arrived with undeniable momentum. The booth remained in constant motion, drawing in global distributors, influential...",,2026-03-26T08:05:34.984809,5491f91ded757a322c7c812398162c6a
47970,PR Newswire,投融资与生态,PR新闻通讯社,https://www.prnewswire.com/news-releases/fractus-y-verizon-resuelven-un-litigio-sobre-patentes-302725924.html,"03:56 ETFractus y Verizon resuelven un litigio sobre patentesFractus, pionera en tecnología de antenas y licencias de IP, anunció hoy que llegó a un acuerdo con Verizon, resolviendo el litigio por infracción de ...","Fractus, pionera en tecnología de antenas y licencias de IP, anunció hoy que llegó a un acuerdo con Verizon, resolviendo el litigio por infracción de ...",,2026-03-26T08:05:34.984809,399b9fd5c5236eea3690c7dbb7181c0c
47971,PR Newswire,投融资与生态,PR新闻通讯社,https://www.prnewswire.com/news-releases/sungrows-sht-hybrid-inverter-wins-worlds-first-vde-ar-n-41052026-certification-302725917.html,"03:50 ETSungrow's SHT Hybrid Inverter Wins World's First VDE-AR-N 4105:2026 CertificationSungrow announced that its SHT series residential hybrid inverter has been awarded the VDE-AR-N 4105:2026 certification by TÜV Rheinland, becoming...","Sungrow announced that its SHT series residential hybrid inverter has been awarded the VDE-AR-N 4105:2026 certification by TÜV Rheinland, becoming...",,2026-03-26T08:05:34.984809,b81f0553b9e54ef5d15ba78a4f73d972
47972,PR Newswire,投融资与生态,PR新闻通讯社,https://www.prnewswire.com/news-releases/tazapay-raises-36m-in-total-series-b-funding-to-scale-next-generation-payment-rails-globally-circle-ventures-leads-extension-302725915.html,"03:48 ETTazapay Raises $36M in Total Series B Funding to Scale Next-Generation Payment Rails Globally; Circle Ventures Leads ExtensionTazapay, a leading next-generation payment infrastructure provider for emerging markets, today announced the close of its Series B extension led by...","Tazapay, a leading next-generation payment infrastructure provider for emerging markets, today announced the close of its Series B extension led by...",,2026-03-26T08:05:34.984809,539e552c6ed8d6c81f2469f727b196b2
47973,PR Newswire,投融资与生态,PR新闻通讯社,https://www.prnewswire.com/news-releases/global-carpool-as-a-service-market-to-reach-usd-36-1-billion-by-2032--driven-by-rising-demand-for-cost-effective-and-sustainable-mobility-solutions--markntel-advisors-302725232.html,"03:32 ETGlobal Carpool-as-a-Service Market to Reach USD 36.1 Billion by 2032, Driven by Rising Demand for Cost-Effective and Sustainable Mobility Solutions | MarkNtel AdvisorsAccording to the latest study published by MarkNtel Advisors, the Global Carpool-as-a-Service Market is projected to grow at ","According to the latest study published by MarkNtel Advisors, the Global Carpool-as-a-Service Market is projected to grow at a CAGR of around 9.28%...",,2026-03-26T08:05:34.984809,ba01e18abdf2bc5650a64cce4068dadd
47974,PR Newswire,投融资与生态,PR新闻通讯社,https://www.prnewswire.com/news-releases/armaf-brings-a-sweet-escape-to-cosmoprof-with-their-delights-collection-302725264.html,"03:30 ETArmaf Brings a Sweet Escape to Cosmoprof with their Delights CollectionAt Armaf's presentation at Cosmoprof Bologna 2026, fragrance takes on a brighter, more playful mood with the unveiling of the Armaf Delights...","At Armaf's presentation at Cosmoprof Bologna 2026, fragrance takes on a brighter, more playful mood with the unveiling of the Armaf Delights...",,2026-03-26T08:05:34.984809,93dc799ea0a4029f37378338ae8c4b09
47975,PR Newswire,投融资与生态,PR新闻通讯社,https://www.prnewswire.com/news-releases/armaf-brings-a-sweet-escape-to-cosmoprof-with-their-delights-collection-302725269.html,"03:30 ETArmaf Brings a Sweet Escape to Cosmoprof with their Delights CollectionAt Armaf's presentation at Cosmoprof Bologna 2026, fragrance takes on a brighter, more playful mood with the unveiling of the Armaf Delights...","At Armaf's presentation at Cosmoprof Bologna 2026, fragrance takes on a brighter, more playful mood with the unveiling of the Armaf Delights...",,2026-03-26T08:05:34.984809,a89ec326ab8e8de8f3732eeb9e8dc18b
47976,PR Newswire,投融资与生态,PR新闻通讯社,https://www.prnewswire.com/news-releases/sheins-2025-global-circularity-study-highlights-how-consumers-buy-use-and-manage-clothing-302725888.html,"03:27 ETSHEIN's 2025 Global Circularity Study Highlights How Consumers Buy, Use and Manage ClothingSHEIN, a global online fashion and lifestyle retailer, today released findings from its 2025 Global Circularity Study, offering insights into how...","SHEIN, a global online fashion and lifestyle retailer, today released findings from its 2025 Global Circularity Study, offering insights into how...",,2026-03-26T08:05:34.984809,35baf7d5bbe21023e28c20abcfe3dcb8
47977,PR Newswire,投融资与生态,PR新闻通讯社,https://www.prnewswire.com/news-releases/gigabyte-veroffentlicht-die-z890-plus-motherboards-inklusive-des-top-modells-z890-aorus-elite-duo-x-mit-cqdimm-unterstutzung-302724186.html,"03:00 ETGIGABYTE veröffentlicht die Z890 Plus Motherboards inklusive des Top-Modells Z890 AORUS ELITE DUO X mit CQDIMM-UnterstützungGIGABYTE, einer der führenden Hersteller von Motherboards, Grafikkarten und Hardware-Lösungen, gibt die Verfügbarkeit seiner Motherboards der Z890...","GIGABYTE, einer der führenden Hersteller von Motherboards, Grafikkarten und Hardware-Lösungen, gibt die Verfügbarkeit seiner Motherboards der Z890...",,2026-03-26T08:05:34.984809,405b06082d4391c6ccb182bed895e7db
47978,PR Newswire,投融资与生态,PR新闻通讯社,https://www.prnewswire.com/news-releases/tradezero-expands-european-presence-into-belgium-luxembourg-norway-and-denmark-302724732.html,"03:00 ETTradeZero Expands European Presence into Belgium, Luxembourg, Norway, and DenmarkTradeZero Europe B.V. ('TradeZero Europe') announced the expansion of its services into Belgium, Luxembourg, Norway, and Denmark, building on its...","TradeZero Europe B.V. ('TradeZero Europe') announced the expansion of its services into Belgium, Luxembourg, Norway, and Denmark, building on its...",,2026-03-26T08:05:34.984809,8de06534f96d159ab3729966664d87d4
47979,PR Newswire,投融资与生态,PR新闻通讯社,https://www.prnewswire.com/news-releases/ya-esta-disponible-el-modelo-z890-aorus-elite-duo-x-de-gigabyte-lider-de-la-serie-z890-plus-con-cqdimm-302724187.html,"03:00 ETYa está disponible el modelo Z890 AORUS ELITE DUO X de GIGABYTE, líder de la serie Z890 Plus con CQDIMMGIGABYTE, marca líder mundial en informática, presenta las placas base serie Z890 Plus, diseñadas para aprovechar al máximo el potencial de los...","GIGABYTE, marca líder mundial en informática, presenta las placas base serie Z890 Plus, diseñadas para aprovechar al máximo el potencial de los...",,2026-03-26T08:05:34.984809,61f5a64e4a516d2f274f1eda65b0f344
47980,PR Newswire,投融资与生态,PR新闻通讯社,https://www.prnewswire.com/news-releases/la-gigabyte-z890-aorus-elite-duo-x-est-desormais-disponible--le-modele-phare-de-la-gamme-z890-plus-equipe-de-la-technologie-cqdimm-302724185.html,"03:00 ETLa GIGABYTE Z890 AORUS ELITE DUO X est désormais disponible : le modèle phare de la gamme Z890 Plus équipé de la technologie CQDIMMGIGABYTE, la première marque mondiale d'ordinateurs, annonce la disponibilité de ses cartes mères de la gamme Z890 Plus qui prennent en charge les...","GIGABYTE, la première marque mondiale d'ordinateurs, annonce la disponibilité de ses cartes mères de la gamme Z890 Plus qui prennent en charge les...",,2026-03-26T08:05:34.984809,79847d646155e19ff0ebd2c2beac7a2c
47983,PR Newswire,投融资与生态,PR新闻通讯社,https://www.prnewswire.com/news-releases/sweco-publishes-annual-report-for-2025-302725839.html,"02:47 ETSweco publishes Annual Report for 2025Sweco (NASDAQ: SWEC-B) concluded a strong year in 2025, solidifying its position as Europe's leading architecture and engineering consultancy. With...","Sweco (NASDAQ: SWEC-B) concluded a strong year in 2025, solidifying its position as Europe's leading architecture and engineering consultancy. With...",,2026-03-26T08:05:34.984809,9e202d391b1a428c13306e1320b211a1
47984,PR Newswire,投融资与生态,PR新闻通讯社,https://www.prnewswire.com/news-releases/sheins-2025-global-circularity-study-highlights-how-consumers-buy-use-and-manage-clothing-302725834.html,"02:41 ETSHEIN's 2025 Global Circularity Study Highlights How Consumers Buy, Use and Manage ClothingSHEIN, a global online fashion and lifestyle retailer, today released findings from its 2025 Global Circularity Study, offering insights into how...","SHEIN, a global online fashion and lifestyle retailer, today released findings from its 2025 Global Circularity Study, offering insights into how...",,2026-03-26T08:05:34.984809,fab50b5b83d695b14f50d9852826935f
47985,PR Newswire,投融资与生态,PR新闻通讯社,https://www.prnewswire.com/news-releases/safe-structure-designs-transitions-patented-safe-mule-expeditionary-logistics-platform-into-production-for-us-military-operations-302725637.html,"Mar 25, 2026, 23:54 ETSAFE Structure Designs Transitions Patented SAFE MULE Expeditionary Logistics Platform into Production for U.S. Military OperationsSAFE Structure Designs today announced that the company has successfully completed research and development of the SAFE MULE (Multi-Function Utilit",SAFE Structure Designs today announced that the company has successfully completed research and development of the SAFE MULE (Multi-Function Utility...,,2026-03-26T08:05:34.984809,325feabc5edcc48123cf5ec7b217ee63
47986,PR Newswire,投融资与生态,PR新闻通讯社,https://www.prnewswire.com/news-releases/sany-presente-le-premier-camion-pompe-hybride-intelligent-au-monde-302725508.html,"Mar 25, 2026, 20:50 ETSANY présente le premier camion pompe hybride intelligent au mondeSANY a récemment organisé en Chine un événement de lancement de produits intitulé « Usher New Chapter with Intelligent-Electric Innovation » (Ouvrir...",SANY a récemment organisé en Chine un événement de lancement de produits intitulé « Usher New Chapter with Intelligent-Electric Innovation » (Ouvrir...,,2026-03-26T08:05:34.984809,b7ae2356f2e9f2f02d11d60cc6a5d454
47987,PR Newswire,投融资与生态,PR新闻通讯社,https://www.prnewswire.com/news-releases/srs-distribution-subsidiaria-de-the-home-depot-firma-un-acuerdo-para-adquirir-mingledorff-s-distribuidor-mayorista-de-productos-para-sistemas-de-climatizacion-882072192.html,"Mar 25, 2026, 19:16 ETSRS Distribution, subsidiaria de The Home Depot, firma un acuerdo para adquirir Mingledorff's, distribuidor mayorista de productos para sistemas de climatizaciónSRS Distribution Inc., subsidiaria de The Home Depot®, firmó un acuerdo definitivo para adquirir Mingledorff's, Inc.,","SRS Distribution Inc., subsidiaria de The Home Depot®, firmó un acuerdo definitivo para adquirir Mingledorff's, Inc., empresa líder en distribución...",,2026-03-26T08:05:34.984809,13fcc6a8880b303af58cfc9a50913c55
47988,PR Newswire,投融资与生态,PR新闻通讯社,https://www.prnewswire.com/news-releases/suncrete-and-haymaker-acquisition-corp-4-announce-entering-into-non-redemption-agreements-with-certain-institutional-investors-302725456.html,"Mar 25, 2026, 18:18 ETSuncrete and Haymaker Acquisition Corp. 4 Announce Entering Into Non-Redemption Agreements with Certain Institutional InvestorsConcrete Partners Holding, LLC (""Suncrete"" or the ""Company""), a ready-mix concrete logistics and distribution platform strategically located in...","Concrete Partners Holding, LLC (""Suncrete"" or the ""Company""), a ready-mix concrete logistics and distribution platform strategically located in...",,2026-03-26T08:05:34.984809,008cd7b0bef7282a5b29434a9475adc0
47989,PR Newswire,投融资与生态,PR新闻通讯社,https://www.prnewswire.com/news-releases/tulkubasch--und-kyzyltasch-bergbauanlagen-erklarung-einer-gruppe-von-investoren-302725443.html,"Mar 25, 2026, 18:02 ETTULKUBASCH- UND KYZYLTASCH-BERGBAUANLAGEN: ERKLÄRUNG EINER GRUPPE VON INVESTORENEine Gruppe internationaler Investoren (die „Gruppe""), die beträchtliches Kapital und langjährige Bemühungen in die Entwicklung der Tulkubash- und...","Eine Gruppe internationaler Investoren (die „Gruppe""), die beträchtliches Kapital und langjährige Bemühungen in die Entwicklung der Tulkubash- und...",,2026-03-26T08:05:34.984809,447ada0c47a0a62f6942fea44916559b
47990,PR Newswire,投融资与生态,PR新闻通讯社,https://www.prnewswire.com/news-releases/activos-mineros-de-tulkubash-y-kyzyltash-declaracion-de-un-grupo-de-inversores-302725438.html,"Mar 25, 2026, 17:57 ETActivos mineros de Tulkubash y Kyzyltash: declaración de un grupo de inversoresUn grupo de inversores internacionales (el ""Grupo""), que ha comprometido un capital sustancial y muchos años de esfuerzo para el desarrollo de los...","Un grupo de inversores internacionales (el ""Grupo""), que ha comprometido un capital sustancial y muchos años de esfuerzo para el desarrollo de los...",,2026-03-26T08:05:34.984809,1d9796495c9b0a4a7edcf4b55e33a2f1
