ID,信息源,大类,子类,URL,标题,摘要,发布日期,采集时间,哈希
46821,MIT Technology Review,专业媒体与通讯,科技与商业媒体,https://www.technologyreview.com/,MIT Technology Review,"Why the world doesn’t recycle more nuclear waste
In nuclear energy, figuring out what to do with waste has always been a challenge, since the material needs to be dealt with carefully. [In a new story",,2026-03-26T08:05:05.535231,c221928c666ccceba338081a68e30c6a
46822,欧盟AI Office,政策与监管,国际AI安全机构,https://digital-strategy.ec.europa.eu/en/news/open-eu-foundry-status-granted-innovative-chiplet-facility,Open EU Foundry status granted to innovative chiplet facility,,,2026-03-26T08:05:05.535802,a46d3c5f8398e533853a39b1a5fac465
46823,欧盟AI Office,政策与监管,国际AI安全机构,https://digital-strategy.ec.europa.eu/en/news/commission-holds-first-meeting-special-panel-child-safety-online,Commission holds first meeting of Special Panel on child safety online,,,2026-03-26T08:05:05.535802,5e7db4ad8631d76c941d8bc190651ba2
46824,欧盟AI Office,政策与监管,国际AI安全机构,https://digital-strategy.ec.europa.eu/en/news/european-union-endorses-leaders-declaration-ai-summit-india,European Union endorses Leaders' Declaration at AI Summit in India,,,2026-03-26T08:05:05.535802,2005b9a3b93a102bcee72d97cd7de025
46825,欧盟AI Office,政策与监管,国际AI安全机构,https://digital-strategy.ec.europa.eu/en/news/executive-vice-president-virkkunen-hosts-implementation-dialogue-eu-chips-act,Executive Vice-President Virkkunen hosts Implementation Dialogue on EU Chips Act,"Tomorrow, Executive Vice-President for Technological Sovereignty, Security and Democracy Henna Virkkunen will host a dialogue in Brussels to discuss the implementation of the Chips Act.",,2026-03-26T08:05:05.535802,28040053c62d45f960949738ec315e26
46826,欧盟AI Office,政策与监管,国际AI安全机构,https://digital-strategy.ec.europa.eu/en/news/code-conduct-disinformation-signatories-publish-their-latest-reports-codes-transparency-0,Code of Conduct on Disinformation: Signatories publish their latest reports in the Code’s Transparency Centre,Signatories of the Code of Conduct published their latest reports in the Code’s Transparency Centre. These reports are the first ones since the Code’s recognition as a DSA Code of Conduct.,,2026-03-26T08:05:05.535802,3ecb661df787807abeaad02879f1c34f
46827,欧盟AI Office,政策与监管,国际AI安全机构,https://digital-strategy.ec.europa.eu/en/news/commission-renews-support-exiled-and-relocated-journalists-eu,Commission renews support for exiled and relocated journalists in the EU,"The European Commission has published information on an upcoming call for proposals to support exiled journalists from Belarus and Russia, as well as journalists relocated from Ukraine, as they contin",,2026-03-26T08:05:05.535802,1855f531046eac8f9838af8d3e222a93
46828,欧盟AI Office,政策与监管,国际AI安全机构,https://digital-strategy.ec.europa.eu/en/news/cyber-resilience-act-eu-market-surveillance-group-elects-new-chair-and-vice-chair,Cyber Resilience Act: EU Market Surveillance Group elects New Chair and Vice-Chair,"The first meeting of the Administrative Cooperation Group for the Cyber Resilience Act (CRA) has marked an important step in preparing for the enforcement of the CRA, which will strengthen cybersecuri",,2026-03-26T08:05:05.535802,927882a0e6d2f929bac9740dabbbcf9f
46829,欧盟AI Office,政策与监管,国际AI安全机构,https://digital-strategy.ec.europa.eu/en/news/seventh-ai-board-meeting,Seventh AI Board meeting,The seventh meeting of the AI Board brought together participants to discuss the latest developments in the Commission’s AI strategy.,,2026-03-26T08:05:05.535802,4ce8c454f389ec9add6d5dcd708ea35f
46830,欧盟AI Office,政策与监管,国际AI安全机构,https://digital-strategy.ec.europa.eu/en/news/digital-europe-programme-amended-continue-deployment-innovative-digital-capacities-across-eu,Digital Europe Programme amended to continue the deployment of innovative digital capacities across the EU,The Digital Europe Programme adapts to deliver for Europe’s evolving digital needs.,,2026-03-26T08:05:05.535802,c6039db3f3e0b05e1a318ca1d3674878
46831,欧盟AI Office,政策与监管,国际AI安全机构,https://digital-strategy.ec.europa.eu/en/news/eu-tech-business-offer-kenya,EU Tech Business Offer Kenya,"The European Union and Kenya have officially launched the EU-Kenya Digital Dialogue, significantly bolstering their collaborative efforts in the digital realm.",,2026-03-26T08:05:05.535802,e6f6c246fcd8e644fa5c7b68864bb4ed
46832,欧盟AI Office,政策与监管,国际AI安全机构,https://digital-strategy.ec.europa.eu/en/news/eu-inc-new-digital-company-framework-simplify-cross-border-business-europe,EU Inc.: a new digital company framework to simplify cross-border business in Europe,EU Inc. harnesses digital to support startups and scaleups across Europe.,,2026-03-26T08:05:05.535802,ab39b2267b651af0a9f37d88cc422ffc
46833,欧盟AI Office,政策与监管,国际AI安全机构,https://digital-strategy.ec.europa.eu/en/news/sme-cyber-resilience-act-survey,SME Cyber Resilience Act Survey,"ENISA has launched a survey for SMEs on the Cyber Resilience Act (CRA) with the aim to understand their overall level of CRA awareness, how ready and mature they feel for it, and what kind of support ",,2026-03-26T08:05:05.535802,b13309a5d5ccffb3ef954d305564797d
46834,欧盟AI Office,政策与监管,国际AI安全机构,https://digital-strategy.ec.europa.eu/en/news/commission-makes-available-eu200-million-submarine-cable-and-digital-infrastructure-projects,Commission makes available €200 million for submarine cable and digital infrastructure projects,"The European Commission has opened two new Connecting Europe Facility (CEF) calls worth €200 million for projects in high-capacity networks, including submarine cables.",,2026-03-26T08:05:05.535802,ca7d79cf4e1efd7617756acd5cafc205
46835,Techmeme,专业媒体与通讯,新闻聚合,https://www.theverge.com/policy/900654/meta-google-instagram-youtube-social-media-addiction-trial-kgm-jury-decision,The Verge,,,2026-03-26T08:05:05.536807,39cf794d096fc635b9ed8b8fa7ced044
46836,Techmeme,专业媒体与通讯,新闻聚合,https://arstechnica.com/tech-policy/2026/03/meta-loses-trial-after-arguing-child-exploitation-was-inevitable-on-its-apps/,Ars Technica,,,2026-03-26T08:05:05.536807,bd8b07252367cac48f525735d88a3cde
46837,Techmeme,专业媒体与通讯,新闻聚合,https://www.latimes.com/california/story/2026-03-25/social-media-lawsuit-trial-meta-google-verdict,Los Angeles Times,,,2026-03-26T08:05:05.536807,4f235a64705e522b431b94de2374a90f
46838,Techmeme,专业媒体与通讯,新闻聚合,https://www.nbcnews.com/tech/tech-news/verdict-reached-landmark-social-media-addiction-trial-rcna263421,NBC News,,,2026-03-26T08:05:05.536807,47ecb90be99dbeb00d7562f77f9ae988
46839,Techmeme,专业媒体与通讯,新闻聚合,https://www.bloomberg.com/news/articles/2026-03-25/meta-google-found-liable-in-social-media-addiction-case,Bloomberg,,,2026-03-26T08:05:05.536807,9d31bbf7d8bf8f1bfbd17f44706590f5
46840,Techmeme,专业媒体与通讯,新闻聚合,https://www.wsj.com/tech/meta-and-youtube-lose-landmark-social-media-trial-33e4c5cb?st=Skj1rw&reflink=article_copyURL_share,Wall Street Journal,,,2026-03-26T08:05:05.536807,6b9b61048c808b8b84807cd0edbbbcf6
46841,Techmeme,专业媒体与通讯,新闻聚合,https://www.ft.com/content/d3d80bd4-d2b1-4522-9752-4071df5b4c0a,Financial Times,,,2026-03-26T08:05:05.536807,efe933558b6ac6e305fbd912aabe429d
46842,Techmeme,专业媒体与通讯,新闻聚合,https://www.reuters.com/legal/litigation/jury-reaches-verdict-meta-google-trial-social-media-addiction-2026-03-25/,Reuters,,,2026-03-26T08:05:05.536807,bae08471b99e5f5114c2ee72232b2387
46843,Techmeme,专业媒体与通讯,新闻聚合,https://www.fastcompany.com/91516105/meta-google-los-angeles-social-media-trial-verdict,Fast Company,,,2026-03-26T08:05:05.536807,f18ccaf399055a4249247b338607526c
46844,Techmeme,专业媒体与通讯,新闻聚合,https://www.abc.net.au/news/2026-03-26/meta-and-google-found-liable-for-harm-to-children/106496392,Associated Press,,,2026-03-26T08:05:05.536807,a58b14ce5db00a9c2ed4be58a5bc4c76
46845,Techmeme,专业媒体与通讯,新闻聚合,https://www.cbsnews.com/news/meta-youtube-social-media-addiction-lawsuit-verdict/,CBS News,,,2026-03-26T08:05:05.536807,cba6ab60502d87c68fe32ed8f219a044
46846,Techmeme,专业媒体与通讯,新闻聚合,https://www.nbclosangeles.com/news/local/verdict-la-social-media-addiction-trial/3861059/,NBC Los Angeles,,,2026-03-26T08:05:05.536807,fcc484079d7d8465fb5eac21bc80ad38
46847,Techmeme,专业媒体与通讯,新闻聚合,https://www.the-star.co.ke/news/world/2026-03-26-meta-and-youtube-found-liable-in-landmark-social-media-addiction-trial,The Star,,,2026-03-26T08:05:05.536807,3588af78133d6caee35dc6b75bb6b8e6
46848,Techmeme,专业媒体与通讯,新闻聚合,https://www.usatoday.com/story/tech/2026/03/25/meta-google-trial-verdict/89067895007/,USA Today,,,2026-03-26T08:05:05.536807,86394556a216e068162463a70e6baac5
46849,机器之心,专业媒体与通讯,中文快速聚合,https://www.jiqizhixin.com/,机器之心·数据服务,"机器之心·数据服务
还在
费劲
爬数据？
机器之心数据服务已上线
直接获取数据，
高效又稳定
！
前往了解
276a835d17745123069438345e80b3 深入合作请联系：
zhaoyunfeng@jiqizhixin.com",,2026-03-26T08:05:05.535413,14d322a3a7439219e9252a67c0849e6f
46850,EU AI Act,政策与监管,欧盟政策来源,https://digital-strategy.ec.europa.eu/en/news/open-eu-foundry-status-granted-innovative-chiplet-facility,Open EU Foundry status granted to innovative chiplet facility,,,2026-03-26T08:05:05.536230,a46d3c5f8398e533853a39b1a5fac465
46851,EU AI Act,政策与监管,欧盟政策来源,https://digital-strategy.ec.europa.eu/en/news/commission-holds-first-meeting-special-panel-child-safety-online,Commission holds first meeting of Special Panel on child safety online,,,2026-03-26T08:05:05.536230,5e7db4ad8631d76c941d8bc190651ba2
46852,EU AI Act,政策与监管,欧盟政策来源,https://digital-strategy.ec.europa.eu/en/news/european-union-endorses-leaders-declaration-ai-summit-india,European Union endorses Leaders' Declaration at AI Summit in India,,,2026-03-26T08:05:05.536230,2005b9a3b93a102bcee72d97cd7de025
46853,EU AI Act,政策与监管,欧盟政策来源,https://digital-strategy.ec.europa.eu/en/news/executive-vice-president-virkkunen-hosts-implementation-dialogue-eu-chips-act,Executive Vice-President Virkkunen hosts Implementation Dialogue on EU Chips Act,"Tomorrow, Executive Vice-President for Technological Sovereignty, Security and Democracy Henna Virkkunen will host a dialogue in Brussels to discuss the implementation of the Chips Act.",,2026-03-26T08:05:05.536230,28040053c62d45f960949738ec315e26
46854,EU AI Act,政策与监管,欧盟政策来源,https://digital-strategy.ec.europa.eu/en/news/code-conduct-disinformation-signatories-publish-their-latest-reports-codes-transparency-0,Code of Conduct on Disinformation: Signatories publish their latest reports in the Code’s Transparency Centre,Signatories of the Code of Conduct published their latest reports in the Code’s Transparency Centre. These reports are the first ones since the Code’s recognition as a DSA Code of Conduct.,,2026-03-26T08:05:05.536230,3ecb661df787807abeaad02879f1c34f
46855,EU AI Act,政策与监管,欧盟政策来源,https://digital-strategy.ec.europa.eu/en/news/commission-renews-support-exiled-and-relocated-journalists-eu,Commission renews support for exiled and relocated journalists in the EU,"The European Commission has published information on an upcoming call for proposals to support exiled journalists from Belarus and Russia, as well as journalists relocated from Ukraine, as they contin",,2026-03-26T08:05:05.536230,1855f531046eac8f9838af8d3e222a93
46856,EU AI Act,政策与监管,欧盟政策来源,https://digital-strategy.ec.europa.eu/en/news/cyber-resilience-act-eu-market-surveillance-group-elects-new-chair-and-vice-chair,Cyber Resilience Act: EU Market Surveillance Group elects New Chair and Vice-Chair,"The first meeting of the Administrative Cooperation Group for the Cyber Resilience Act (CRA) has marked an important step in preparing for the enforcement of the CRA, which will strengthen cybersecuri",,2026-03-26T08:05:05.536230,927882a0e6d2f929bac9740dabbbcf9f
46857,EU AI Act,政策与监管,欧盟政策来源,https://digital-strategy.ec.europa.eu/en/news/seventh-ai-board-meeting,Seventh AI Board meeting,The seventh meeting of the AI Board brought together participants to discuss the latest developments in the Commission’s AI strategy.,,2026-03-26T08:05:05.536230,4ce8c454f389ec9add6d5dcd708ea35f
46858,EU AI Act,政策与监管,欧盟政策来源,https://digital-strategy.ec.europa.eu/en/news/digital-europe-programme-amended-continue-deployment-innovative-digital-capacities-across-eu,Digital Europe Programme amended to continue the deployment of innovative digital capacities across the EU,The Digital Europe Programme adapts to deliver for Europe’s evolving digital needs.,,2026-03-26T08:05:05.536230,c6039db3f3e0b05e1a318ca1d3674878
46859,EU AI Act,政策与监管,欧盟政策来源,https://digital-strategy.ec.europa.eu/en/news/eu-tech-business-offer-kenya,EU Tech Business Offer Kenya,"The European Union and Kenya have officially launched the EU-Kenya Digital Dialogue, significantly bolstering their collaborative efforts in the digital realm.",,2026-03-26T08:05:05.536230,e6f6c246fcd8e644fa5c7b68864bb4ed
46860,EU AI Act,政策与监管,欧盟政策来源,https://digital-strategy.ec.europa.eu/en/news/eu-inc-new-digital-company-framework-simplify-cross-border-business-europe,EU Inc.: a new digital company framework to simplify cross-border business in Europe,EU Inc. harnesses digital to support startups and scaleups across Europe.,,2026-03-26T08:05:05.536230,ab39b2267b651af0a9f37d88cc422ffc
46861,EU AI Act,政策与监管,欧盟政策来源,https://digital-strategy.ec.europa.eu/en/news/sme-cyber-resilience-act-survey,SME Cyber Resilience Act Survey,"ENISA has launched a survey for SMEs on the Cyber Resilience Act (CRA) with the aim to understand their overall level of CRA awareness, how ready and mature they feel for it, and what kind of support ",,2026-03-26T08:05:05.536230,b13309a5d5ccffb3ef954d305564797d
46862,EU AI Act,政策与监管,欧盟政策来源,https://digital-strategy.ec.europa.eu/en/news/commission-makes-available-eu200-million-submarine-cable-and-digital-infrastructure-projects,Commission makes available €200 million for submarine cable and digital infrastructure projects,"The European Commission has opened two new Connecting Europe Facility (CEF) calls worth €200 million for projects in high-capacity networks, including submarine cables.",,2026-03-26T08:05:05.536230,ca7d79cf4e1efd7617756acd5cafc205
46863,EU AI Act,政策与监管,欧盟政策来源,https://digital-strategy.ec.europa.eu/en/library/action-plan-against-cyberbullying,Action Plan against cyberbullying,,,2026-03-26T08:05:05.536230,d7b60bb22cc27815d51099cc10ba31ec
46864,EU AI Act,政策与监管,欧盟政策来源,https://digital-strategy.ec.europa.eu/en/library/proposal-regulation-digital-networks-act-dna,Proposal for a Regulation for the Digital Networks Act (DNA),,,2026-03-26T08:05:05.536230,e77f34e96565f512df132c10b331a747
46865,EU AI Act,政策与监管,欧盟政策来源,https://digital-strategy.ec.europa.eu/en/library/proposal-directive-regards-simplification-measures-and-alignment-cybersecurity-act,Proposal for a Directive as regards simplification measures and alignment with the Cybersecurity Act,,,2026-03-26T08:05:05.536230,7125574fb8878c74c5379dce6f147476
46866,EU AI Act,政策与监管,欧盟政策来源,https://digital-strategy.ec.europa.eu/en/library/advances-virtual-worlds-defence,Advances in virtual worlds for defence,"The European Commission and the Virtual Worlds Association discussed advances in virtual worlds for defence, setting out priorities in research and innovation, sovereignty and coordination.",,2026-03-26T08:05:05.536230,e15b10f19dc5f8811aa769fff55452e2
46867,EU AI Act,政策与监管,欧盟政策来源,https://digital-strategy.ec.europa.eu/en/library/2026-financing-decision-multimedia-actions,2026 Financing Decision on Multimedia Actions,"Multimedia Actions are aiming at funding information, news and programmes about the European Union, directed at the general public.",,2026-03-26T08:05:05.536230,4a6ee16db6672a78cc71f6891d916517
46868,EU AI Act,政策与监管,欧盟政策来源,https://digital-strategy.ec.europa.eu/en/library/financing-pilot-projects-and-preparatory-actions-field-communications-networks-content-3,"Financing of pilot projects and preparatory actions in the field of ""Communications Networks, Content and Technology"" - 2026","The annual financing decision, constituting the annual work programme for the implementation of the pilot projects and preparatory actions in the field of “Communications Networks, Content and Technol",,2026-03-26T08:05:05.536230,0bbe6bfc138f0784fd1cf1feaa6782ef
46869,EU AI Act,政策与监管,欧盟政策来源,https://digital-strategy.ec.europa.eu/en/library/workshop-explores-software-defined-and-ai-driven-future-european-drone-industry,Workshop explores Software-defined and AI-driven future for European drone industry,The European Commission and the HIPEAC network hosted a workshop on Distributed and decentralised intelligence for future drone swarm applications on 26 February 2026 in Brussels.,,2026-03-26T08:05:05.536230,35645a8edd24b508852ee2468f3cdd7a
46870,EU AI Act,政策与监管,欧盟政策来源,https://digital-strategy.ec.europa.eu/en/library/5g4lives-protecting-lives-and-environment-riga-and-turin,5G4LIVES: protecting lives and the environment in Riga and Turin,5G4LIVES uses hybrid private 5G networks and AI-enabled drones to strengthen emergency response and environmental protection in the cities of Riga and Turin.,,2026-03-26T08:05:05.536230,aeeb1ce738b7b9dbc2c21d2bcab45770
46871,EU AI Act,政策与监管,欧盟政策来源,https://digital-strategy.ec.europa.eu/en/library/factual-summary-report-targeted-consultation-notification-suspicions-criminal-offences-under-dsa,Factual Summary Report on the targeted consultation on the notification of suspicions of criminal offences under DSA,The targeted consultation is part of an ongoing effort to ensure the effective application of the provision across the Member States and to help their Digital Services Coordinators (“DSCs”) to monitor,,2026-03-26T08:05:05.536230,eea99cc025bcdb68bcbedbf5aa4cd8c4
46872,EU AI Act,政策与监管,欧盟政策来源,https://digital-strategy.ec.europa.eu/en/library/study-artificial-intelligence-healthcare-dissects-digital-health-technologies-europe,Study on Artificial Intelligence in healthcare dissects digital health technologies in Europe,"This study analyses the EU digital health market and economic impact of digital health technologies, including AI-enabled solutions.",,2026-03-26T08:05:05.536230,358534b31c2c382c729294929aaa74eb
46873,EU AI Act,政策与监管,欧盟政策来源,https://digital-strategy.ec.europa.eu/en/library/commission-publishes-second-draft-code-practice-marking-and-labelling-ai-generated-content,Commission publishes second draft of Code of Practice on Marking and Labelling of AI-generated content,"To help providers and deployers meet the marking and labelling requirements for AI generated content under Article 50 AI Act, the Commission is facilitating the development of a voluntary code of prac",,2026-03-26T08:05:05.536230,b9f98bd4ce9484e33b561fc3917a1dcf
46874,EU AI Act,政策与监管,欧盟政策来源,https://digital-strategy.ec.europa.eu/en/library/mobile-and-fixed-broadband-price-europe-2024-insights-european-broadband-market,Mobile and fixed broadband price in Europe in 2024: Insights into the European Broadband Market,"In 2024, prices for fixed broadband services fell by an average of 5% while prices for mobile internet services dropped by 14% compared to 2023.",,2026-03-26T08:05:05.536230,cf2a69b51f0c8e44825a738be1a1c42d
46875,EU AI Act,政策与监管,欧盟政策来源,https://digital-strategy.ec.europa.eu/en/library/stronger-cybersecurity-interconnected-world,Stronger cybersecurity in an interconnected world,The EU-funded TELEMETRY project is developing reliable tools to detect cyber threats and vulnerabilities in Internet of things ecosystems.,,2026-03-26T08:05:05.536230,a85688d48a4efba14ef9c5fd595e6a32
46876,IT之家,专业媒体与通讯,中文快速聚合,https://www.ithome.com/0/932/957.htm,非营利组织上线首个“AI 失业补助”：每月发 1000 美元，持续 1 年,,,2026-03-26T08:05:05.536982,835c42bfddff1d7a22680a4d4d50293c
46877,IT之家,专业媒体与通讯,中文快速聚合,https://www.ithome.com/0/932/936.htm,Anthropic 经济报告：AI 暂未导致大规模失业，真正危机是“技能鸿沟”,,,2026-03-26T08:05:05.536982,eaa376f4903d2b7e55b5ca14b3d5cb33
46878,IT之家,专业媒体与通讯,中文快速聚合,https://www.ithome.com/0/932/914.htm,Meta CEO 扎克伯格宣布推出中小企业扶持计划，推动 AI 应用落地,,,2026-03-26T08:05:05.536982,aa402686660af4fa3b0889b7cb9eec7f
46879,IT之家,专业媒体与通讯,中文快速聚合,https://www.ithome.com/0/932/875.htm,11 人走 10 人：消息称 xAI 创始团队仅剩一人，马斯克亲自接管迎 IPO,,,2026-03-26T08:05:05.536982,88b4a1b508272eb8f37409f9077540c7
46880,IT之家,专业媒体与通讯,中文快速聚合,https://www.ithome.com/0/932/806.htm,卡巴斯基示警微软用户：无代码 AI 工具被滥用成网络钓鱼“隐形外衣”,,,2026-03-26T08:05:05.536982,254f3f13e3f637bbf0c8f82f5edce938
46881,IT之家,专业媒体与通讯,中文快速聚合,https://www.ithome.com/0/932/786.htm,谷歌 TurboQuant 引爆存储芯片崩盘：AI 内存占用锐降至 1/6、推理狂飙 8 倍,,,2026-03-26T08:05:05.536982,6e7990765b0c627271d11aab0cb518bc
46882,IT之家,专业媒体与通讯,中文快速聚合,https://www.ithome.com/0/932/751.htm,微软 OneDrive 新增 AI 修图：主体零失真，照片秒变动漫 / 素描等风格,,,2026-03-26T08:05:05.536982,070491c35005f639556b7b7582659364
46883,IT之家,专业媒体与通讯,中文快速聚合,https://www.ithome.com/0/932/742.htm,OpenAI Sora 退场点燃 AI 视频赛道变局，马斯克预告“史诗级”Grok 加倍押注,,,2026-03-26T08:05:05.536982,363c782b109c787ff2296ce0b02743eb
46884,IT之家,专业媒体与通讯,中文快速聚合,https://www.ithome.com/0/932/734.htm,苹果联合打造 RubiCap 框架：让 AI 描述图像每个细节，性能击败 10 倍体量对手,,,2026-03-26T08:05:05.536982,c72bcd87c48994b4a45c74919c57226d
46885,IT之家,专业媒体与通讯,中文快速聚合,https://www.ithome.com/0/932/718.htm,消息称苹果拆解谷歌 Gemini 模型，为 iPhone 17 等打造专属本地 AI,,,2026-03-26T08:05:05.536982,8ffaca61f232b3406a40c96aa6d1aefd
46886,IT之家,专业媒体与通讯,中文快速聚合,https://www.ithome.com/0/932/693.htm,豪赌 AI！Meta 首次为高管推出股票期权激励计划，与市值涨六倍挂钩,,,2026-03-26T08:05:05.536982,963ced4bc46980efa37b90fc254c7466
46887,IT之家,专业媒体与通讯,中文快速聚合,https://www.ithome.com/0/932/390.htm,拒绝重复造轮子：Mozilla 首发 cq 共享知识库，让 AI 编程学会“抄作业”,,,2026-03-26T08:05:05.536982,913be4d59a0370cfc91544fb5afb88ae
46888,IT之家,专业媒体与通讯,中文快速聚合,https://www.ithome.com/0/932/342.htm,AI 圈地震：月安装量约 9500 万次的 API 网关 LiteLLM 遭投毒，波及 OpenAI / Anthropic 等用户,,,2026-03-26T08:05:05.536982,6e7519e9b5add4d778382ce2706c7562
46889,IT之家,专业媒体与通讯,中文快速聚合,https://www.ithome.com/0/932/334.htm,OpenAI 本周将升级 ChatGPT，实现 AI 直接比价与一键购物,,,2026-03-26T08:05:05.536982,d3e4daabf01cefce28979671848e369c
46890,IT之家,专业媒体与通讯,中文快速聚合,https://www.ithome.com/0/932/291.htm,全球最大主权财富基金拟让 AI 参与投资决策，人类监督不可或缺,,,2026-03-26T08:05:05.536982,16cd9b79e94681b6e4326a1c408fb4dc
46891,IT之家,专业媒体与通讯,中文快速聚合,https://www.ithome.com/0/932/260.htm,苹果联合创始人沃兹尼亚克：AI 体验常令人失望，自己很少使用,,,2026-03-26T08:05:05.536982,46d1434792adb1843aad94bb96c373b0
46892,IT之家,专业媒体与通讯,中文快速聚合,https://www.ithome.com/0/932/255.htm,甲骨文 CEO 西西里亚：AI 不会取代人类，而是增强能力,,,2026-03-26T08:05:05.536982,6206aabcd0474504c256513650de8d98
46893,IT之家,专业媒体与通讯,中文快速聚合,https://www.ithome.com/0/932/098.htm,英伟达最贵 AI 机架：Vera Rubin 单台预估最高 700 万美元，微软、亚马逊等再贵也要买,,,2026-03-26T08:05:05.536982,564aa427211f9189f2ef89096e6dc1c6
46894,IT之家,专业媒体与通讯,中文快速聚合,https://www.ithome.com/0/931/873.htm,国家数据局局长刘烈宏：今年 3 月中国日均 Token 调用量已突破 140 万亿，两年增长超千倍,,,2026-03-26T08:05:05.536982,b18468d59170ebfa7c38ecaee5b02234
46895,IT之家,专业媒体与通讯,中文快速聚合,https://www.ithome.com/0/931/860.htm,卡普空表态：游戏内容不会使用 AI 生成的素材，但将用 AI 提升开发效率,,,2026-03-26T08:05:05.536982,4ebca9b2ce339381f0c4b2aa37658a3a
