ID,信息源,大类,子类,URL,标题,摘要,发布日期,采集时间,哈希
34826,PR Newswire,投融资与生态,PR新闻通讯社,https://www.prnewswire.com/news-releases/dxc-recognized-on-forbes-2026-list-of-americas-best-management-consulting-firms-302716230.html,"Mar 17, 2026, 12:15 ETDXC Recognized on Forbes' 2026 List of America's Best Management Consulting FirmsDXC Technology (NYSE: DXC), a leading enterprise technology and innovation partner, has been recognized for the fourth consecutive year in Forbes'...","DXC Technology (NYSE: DXC), a leading enterprise technology and innovation partner, has been recognized for the fourth consecutive year in Forbes'...",,2026-03-18T07:57:48.191017,bbb506f4c921dc2e3250a9fe073d1934
34827,PR Newswire,投融资与生态,PR新闻通讯社,https://www.prnewswire.com/news-releases/policy-public-interest-latest-news/,"Feb 20, 2026, 17:59 ETVanda Pharmaceuticals Announces FDA Approval of BYSANTI™ (milsaperidone) for the treatment of...","WASHINGTON, Feb. 20, 2026 /PRNewswire/ -- Vanda Pharmaceuticals Inc. (Nasdaq: VNDA) today announced that the U.S. Food and Drug Administration (FDA) has approved BYSANTI™ (milsaperidone) tablets, a...",,2026-03-18T07:57:48.191017,454de14f9891729c4ca34f6edfe39f77
34833,PR Newswire,投融资与生态,PR新闻通讯社,https://www.prnewswire.com/news-releases/chinas-key-legislative-tasks-for-2026-302716740.html,"Mar 17, 2026, 21:49 ETChina's key legislative tasks for 2026A news report from en.npc.gov.cn.cdurl.cn: The annual report on the work of the Standing Committee of the National People's Congress (NPC), China's...","A news report from en.npc.gov.cn.cdurl.cn: The annual report on the work of the Standing Committee of the National People's Congress (NPC), China's...",,2026-03-18T07:57:48.191017,6b51e7020fe062ad85fb31505ef22438
34834,PR Newswire,投融资与生态,PR新闻通讯社,https://www.prnewswire.com/news-releases/innorna-annonce-la-designation-par-la-fda-de-nouveau-medicament-de-recherche-pour-in026-faisant-progresser-les-therapies-basees-sur-larnm-dans-les-maladies-metaboliques-chroniques-302716721.html,"Mar 17, 2026, 21:30 ETInnorna annonce la désignation par la FDA de nouveau médicament de recherche pour IN026, faisant progresser les thérapies basées sur l'ARNm dans les maladies métaboliques chroniquesInnorna, une société de biotechnologie au stade clinique qui fait progresser les médicaments à ba","Innorna, une société de biotechnologie au stade clinique qui fait progresser les médicaments à base d'ARN, a annoncé aujourd'hui que la Food and Drug ...",,2026-03-18T07:57:48.191017,a51d7e6b8f1a67008f4d7713b564bb8c
34835,PR Newswire,投融资与生态,PR新闻通讯社,https://www.prnewswire.com/news-releases/innorna-gibt-die-genehmigung-des-ind-antrags-fur-in026-durch-die-fda-bekannt-und-treibt-damit-die-entwicklung-von-mrna-basierten-therapien-fur-chronische-stoffwechselerkrankungen-voran-302716719.html,"Mar 17, 2026, 21:26 ETInnorna gibt die Genehmigung des IND-Antrags für IN026 durch die FDA bekannt und treibt damit die Entwicklung von mRNA-basierten Therapien für chronische Stoffwechselerkrankungen voranInnorna, ein Biotechnologieunternehmen im klinischen Stadium, das RNA-Medikamente entwickelt, ","Innorna, ein Biotechnologieunternehmen im klinischen Stadium, das RNA-Medikamente entwickelt, gab heute bekannt, dass die US-amerikanische...",,2026-03-18T07:57:48.191017,ff2a485216ce26050029d9a3c367643b
34836,PR Newswire,投融资与生态,PR新闻通讯社,https://www.prnewswire.com/news-releases/innorna-anuncia-la-aprobacion-de-la-fda-de-ind-para-in026-302716710.html,"Mar 17, 2026, 20:54 ETInnorna anuncia la aprobación de la FDA de IND para IN026Innorna, una empresa de biotecnología en fase clínica que desarrolla medicamentos basados en ARN, anunció hoy que la Administración de Alimentos y...","Innorna, una empresa de biotecnología en fase clínica que desarrolla medicamentos basados en ARN, anunció hoy que la Administración de Alimentos y...",,2026-03-18T07:57:48.191017,dcca8136d8c463f115e050823aad9814
34837,PR Newswire,投融资与生态,PR新闻通讯社,https://www.prnewswire.com/news-releases/brayton-purcell-llp-responds-to-san-jose-mercury-news-investigation-highlighting-bay-area-silicosis-crisis-tied-to-crystalline-silica-artificial-stone-302716544.html,"Mar 17, 2026, 18:47 ETBrayton Purcell LLP Responds to San Jose Mercury News Investigation Highlighting Bay Area Silicosis Crisis Tied to Crystalline Silica Artificial StoneBrayton Purcell LLP today responded to major reporting published yesterday by the San Jose Mercury News, which documents the rap","Brayton Purcell LLP today responded to major reporting published yesterday by the San Jose Mercury News, which documents the rapidly accelerating...",,2026-03-18T07:57:48.191017,3473d6af79915a726cffd4306aac9e1b
34838,PR Newswire,投融资与生态,PR新闻通讯社,https://www.prnewswire.com/news-releases/finseca-ceo-end-of-fiduciary-rule-is-a-win-for-retirement-savers-302716612.html,"Mar 17, 2026, 18:46 ETFinseca CEO: End of Fiduciary Rule is a Win For Retirement SaversFinseca released the following statement after today's federal court ruling ending the Department of Labor's (DOL) Fiduciary Rule: ""Today's court...","Finseca released the following statement after today's federal court ruling ending the Department of Labor's (DOL) Fiduciary Rule: ""Today's court...",,2026-03-18T07:57:48.191017,b23ae9c4a2f07bf589de0d0eb038f322
34839,PR Newswire,投融资与生态,PR新闻通讯社,https://www.prnewswire.com/news-releases/pseg-applauds-ferc-decision-protecting-its-customers-from-unfair-transmission-costs-302716526.html,"Mar 17, 2026, 16:39 ETPSE&G Applauds FERC Decision Protecting Its Customers From Unfair Transmission CostsPSE&G announced today that the Federal Energy Regulatory Commission (FERC) has issued a major decision rejecting a proposed settlement that would...",PSE&G announced today that the Federal Energy Regulatory Commission (FERC) has issued a major decision rejecting a proposed settlement that would...,,2026-03-18T07:57:48.191017,ec3e17b28682f1b6a91a913786394071
34840,PR Newswire,投融资与生态,PR新闻通讯社,https://www.prnewswire.com/news-releases/federal-court-dismisses-lawsuit-against-full-sail-university-and-other-defendants-302716513.html,"Mar 17, 2026, 16:19 ETFederal Court Dismisses Lawsuit Against Full Sail University and Other DefendantsA federal court has dismissed a lawsuit against Full Sail University and all other defendants, ruling that all the claims in the complaint were...","A federal court has dismissed a lawsuit against Full Sail University and all other defendants, ruling that all the claims in the complaint were...",,2026-03-18T07:57:48.191017,e93c62f9e1283c13afc8bd57e7ba4938
34841,PR Newswire,投融资与生态,PR新闻通讯社,https://www.prnewswire.com/news-releases/saylor-academy-becomes-saylor-university-advancing-the-vision-of-a-free-global-university-302716497.html,"Mar 17, 2026, 16:04 ETSaylor Academy Becomes Saylor University, Advancing the Vision of a Free Global UniversitySaylor Academy announced today that it has received approval from the Florida Department of Education's Commission for Independent Education to...",Saylor Academy announced today that it has received approval from the Florida Department of Education's Commission for Independent Education to...,,2026-03-18T07:57:48.191017,30fbb9be46de643e553d081a9649812e
34842,PR Newswire,投融资与生态,PR新闻通讯社,https://www.prnewswire.com/news-releases/10-000-teamsters-nurses-at-corewell-health-east-authorize-a-strike-302716363.html,"Mar 17, 2026, 16:00 ET10,000 TEAMSTERS NURSES AT COREWELL HEALTH EAST AUTHORIZE A STRIKERegistered nurses at Corewell Health East, represented by Teamsters Local 2024, have voted by nearly 90 percent to authorize a strike. The 10,000...","Registered nurses at Corewell Health East, represented by Teamsters Local 2024, have voted by nearly 90 percent to authorize a strike. The 10,000...",,2026-03-18T07:57:48.191017,5787c7fa7418fc70eb66ab9a185a8405
34843,PR Newswire,投融资与生态,PR新闻通讯社,https://www.prnewswire.com/news-releases/clean-elections-to-produce-2026-candidate-debates-with-the-arizona-media-association-at-new-location-302716462.html,"Mar 17, 2026, 15:37 ETClean Elections to Produce 2026 Candidate Debates with the Arizona Media Association at New LocationClean Elections, Arizona's only non-partisan voter education entity, statutorily authorized to run candidate debates, announces a continued,...","Clean Elections, Arizona's only non-partisan voter education entity, statutorily authorized to run candidate debates, announces a continued,...",,2026-03-18T07:57:48.191017,1bd408cf3dec437519bea0c20faf725d
34844,PR Newswire,投融资与生态,PR新闻通讯社,https://www.prnewswire.com/news-releases/firstenergy-power-restoration-update-302716414.html,"Mar 17, 2026, 14:50 ETFirstEnergy Power Restoration UpdateFirstEnergy Corp. (NYSE: FE) utilities have made significant progress restoring power following Friday's windstorm, with most customers now back in...","FirstEnergy Corp. (NYSE: FE) utilities have made significant progress restoring power following Friday's windstorm, with most customers now back in...",,2026-03-18T07:57:48.191017,420dea59ec56a2abaf9da1e6aa6a343e
34845,PR Newswire,投融资与生态,PR新闻通讯社,https://www.prnewswire.com/news-releases/alzheimers-association-announces-new-brain-health-roundtable-302716396.html,"Mar 17, 2026, 14:35 ETAlzheimer's Association Announces New Brain Health RoundtableThe Alzheimer's Association today announced the launch of the Alzheimer's Association Brain Health Roundtable, a new cross–sector coalition working...","The Alzheimer's Association today announced the launch of the Alzheimer's Association Brain Health Roundtable, a new cross–sector coalition working...",,2026-03-18T07:57:48.191017,eb71587e232ba6965287f859b13ab152
34846,PR Newswire,投融资与生态,PR新闻通讯社,https://www.prnewswire.com/news-releases/over-400-signatories-ask-minnesota-to-pass-resolution-condemning-hinduphobia-302716357.html,"Mar 17, 2026, 14:07 ETOver 400 Signatories Ask Minnesota to Pass Resolution Condemning HinduphobiaThe Coalition of Hindus of North America (CoHNA) welcomes the introduction of Resolution SF 4115 in the Minnesota Legislature condemning Hinduphobia...",The Coalition of Hindus of North America (CoHNA) welcomes the introduction of Resolution SF 4115 in the Minnesota Legislature condemning Hinduphobia...,,2026-03-18T07:57:48.191017,a6ed7fe188253fbc86a81b85ff740ca9
34847,PR Newswire,投融资与生态,PR新闻通讯社,https://www.prnewswire.com/news-releases/food-is-medicine-coalition-releases-first-ever-blueprint-to-sustain-and-scale-medically-tailored-meals-in-us-healthcare-302716000.html,"Mar 17, 2026, 14:00 ETFood Is Medicine Coalition Releases First-Ever Blueprint to Sustain and Scale Medically Tailored Meals in U.S. HealthcareThe Food Is Medicine Coalition (FIMC), in partnership with the Center for Health Law and Policy Innovation (CHLPI) of Harvard Law School, today...","The Food Is Medicine Coalition (FIMC), in partnership with the Center for Health Law and Policy Innovation (CHLPI) of Harvard Law School, today...",,2026-03-18T07:57:48.191017,3e29f524f23ff2e7c5a9d2dcb13b291c
34848,PR Newswire,投融资与生态,PR新闻通讯社,https://www.prnewswire.com/news-releases/health-care-organizations-press-congress-to-end-mppr-policy-302716263.html,"Mar 17, 2026, 14:00 ETHealth Care Organizations Press Congress to End MPPR Policy|The American Physical Therapy Association and a coalition of rehabilitation and health care organizations are urging Congress to end the Multiple...",The American Physical Therapy Association and a coalition of rehabilitation and health care organizations are urging Congress to end the Multiple...,,2026-03-18T07:57:48.191017,b2891019ec5952d7844dd383d2de122d
34849,PR Newswire,投融资与生态,PR新闻通讯社,https://www.prnewswire.com/news-releases/potts-law-firm-files-wrongful-death-lawsuit-in-kansas-city-following-fatal-fiery-trucking-crash-302716314.html,"Mar 17, 2026, 13:32 ETPotts Law Firm Files Wrongful Death Lawsuit in Kansas City Following Fatal Fiery Trucking CrashPotts Law Firm, a leading plaintiffs' litigation and trial firm, has filed a wrongful death lawsuit in Kansas City, Missouri on behalf of the...","Potts Law Firm, a leading plaintiffs' litigation and trial firm, has filed a wrongful death lawsuit in Kansas City, Missouri on behalf of the...",,2026-03-18T07:57:48.191017,65a2d292c59a979f98f0c216705230b1
34850,PR Newswire,投融资与生态,PR新闻通讯社,https://www.prnewswire.com/news-releases/ten-school-finalists-named-in-new-prize-recognizing-innovative-approaches-to-career-exploration-for-middle-and-high-school-students-302716091.html,"Mar 17, 2026, 13:20 ETTen School Finalists Named in New Prize Recognizing Innovative Approaches to Career Exploration for Middle and High School StudentsBuilding Hope, a national nonprofit that supports the growth and success of innovative schools, today announced the ten finalists for the Future...","Building Hope, a national nonprofit that supports the growth and success of innovative schools, today announced the ten finalists for the Future...",,2026-03-18T07:57:48.191017,9b2905bdf836a944067070bd3cbc9fef
34851,PR Newswire,投融资与生态,PR新闻通讯社,https://www.prnewswire.com/news-releases/nssfs-project-childsafe-and-local-leaders-launch-project-childsafe-tuscaloosa-to-promote-firearm-safety-302716295.html,"Mar 17, 2026, 13:13 ETNSSF's Project ChildSafe and Local Leaders Launch ""Project ChildSafe Tuscaloosa"" to Promote Firearm SafetyNSSF®, The Firearm Industry Trade Association, and its Project ChildSafe® program today announced the launch of ""Project ChildSafe Tuscaloosa"" in...","NSSF®, The Firearm Industry Trade Association, and its Project ChildSafe® program today announced the launch of ""Project ChildSafe Tuscaloosa"" in...",,2026-03-18T07:57:48.191017,61d4179c021e41741a4e05d0f80f6432
34852,PR Newswire,投融资与生态,PR新闻通讯社,https://www.prnewswire.com/news-releases/pseg-earns-national-recognition-for-corporate-citizenship-and-community-impact-302716262.html,"Mar 17, 2026, 13:00 ETPSEG Earns National Recognition for Corporate Citizenship and Community ImpactPublic Service Enterprise Group (PSEG) is proud to announce we have been honored with three national distinctions that reflect our focus on the...",Public Service Enterprise Group (PSEG) is proud to announce we have been honored with three national distinctions that reflect our focus on the...,,2026-03-18T07:57:48.191017,0f1152d28859d827c463abb0537d4376
34853,PR Newswire,投融资与生态,PR新闻通讯社,https://www.prnewswire.com/il/news-releases/elbit-systems-announces-the-filing-of-its-annual-report-on-form-20-f-for-fiscal-year-2025-302716521.html,"17 Mar, 2026, 22:31 ISTElbit Systems Announces the Filing of its Annual Report on Form 20-F for Fiscal Year 2025Elbit Systems Ltd. (NASDAQ: ESLT) (TASE: ESLT) (""Elbit Systems"" or the ""Company"") announced today that on March 17, 2026, the Company filed its...","Elbit Systems Ltd. (NASDAQ: ESLT) (TASE: ESLT) (""Elbit Systems"" or the ""Company"") announced today that on March 17, 2026, the Company filed its...",,2026-03-18T07:57:48.191017,d840e82783ba9013dfd74416cb4827c3
34854,PR Newswire,投融资与生态,PR新闻通讯社,https://www.prnewswire.com/il/news-releases/fize-medical-to-present-an-abstract-at-the-2026-society-of-critical-care-medicine-congress-302716243.html,"17 Mar, 2026, 18:23 ISTFIZE Medical to Present an Abstract at the 2026 Society of Critical Care Medicine CongressFIZE Medical is pleased to share that a clinical research abstract featuring data obtained using the FIZE kUO® platform has been accepted for oral...",FIZE Medical is pleased to share that a clinical research abstract featuring data obtained using the FIZE kUO® platform has been accepted for oral...,,2026-03-18T07:57:48.191017,a4189207f8b558b4591e487039ac9d23
34855,PR Newswire,投融资与生态,PR新闻通讯社,https://www.prnewswire.com/il/news-releases/centera-photonics-announces-first-1-6tbps-dr8-lpo-transceiver-based-on-newphotonics-lpo-pic-with-integrated-ospic-optical-signal-processor-302713692.html,"17 Mar, 2026, 16:15 ISTCentera Photonics Announces First 1.6Tbps DR8 LPO Transceiver based on NewPhotonics® LPO+™ PIC with Integrated OSPic™ Optical Signal ProcessorCentera Photonics Inc., a silicon photonics optical solution provider for data center interconnect, today announced its first 1.6Tbps D","Centera Photonics Inc., a silicon photonics optical solution provider for data center interconnect, today announced its first 1.6Tbps DR8 LPO...",,2026-03-18T07:57:48.191017,c61f9988c166b545910faec2645f53b1
34856,PR Newswire,投融资与生态,PR新闻通讯社,https://www.prnewswire.com/il/news-releases/tumi-unveils-the-mediterranean-escape-celebrating-the-allure-of-the-coast-and-the-ease-of-travel-302703014.html,"17 Mar, 2026, 15:00 ISTTUMI UNVEILS THE ""MEDITERRANEAN ESCAPE"" CELEBRATING THE ALLURE OF THE COAST AND THE EASE OF TRAVELToday, international travel, lifestyle, and accessories brand TUMI introduces ""Mediterranean Escape,"" its Spring 2026 seasonal campaign and...","Today, international travel, lifestyle, and accessories brand TUMI introduces ""Mediterranean Escape,"" its Spring 2026 seasonal campaign and...",,2026-03-18T07:57:48.191017,b61f67cf4efb3e16276181902f0eced7
34857,PR Newswire,投融资与生态,PR新闻通讯社,https://www.prnewswire.com/il/news-releases/phasev-launches-ai-conductor-to-automate-protocol-to-submission-clinical-workflows-302716006.html,"17 Mar, 2026, 14:47 ISTPhaseV Launches AI Conductor to Automate Protocol-to-Submission Clinical WorkflowsPhaseV, a leader in AI/ML for clinical development, today announced the launch of its AI Conductor, a centralized platform that automates the entire...","PhaseV, a leader in AI/ML for clinical development, today announced the launch of its AI Conductor, a centralized platform that automates the entire...",,2026-03-18T07:57:48.191017,f9867600970884e84107ce6e2843051f
34858,PR Newswire,投融资与生态,PR新闻通讯社,https://www.prnewswire.com/il/news-releases/imc-announces-a-strategic-entry-to-the-cyber-drone-interception-and-satellite-intelligence-markets-by-signing-a-non-binding-agreement-to-acquire-51-of-blackaxe-technologies-857769335.html,"17 Mar, 2026, 14:37 ISTIMC Announces a Strategic Entry to the Cyber Drone Interception and Satellite Intelligence Markets by Signing a Non-Binding Agreement to Acquire 51% of Blackaxe TechnologiesIM Cannabis Corp. (""IMC"" or the ""Company"") (NASDAQ: IMCC), a medical cannabis company with operations in","IM Cannabis Corp. (""IMC"" or the ""Company"") (NASDAQ: IMCC), a medical cannabis company with operations in Israel and Germany, today announced that,...",,2026-03-18T07:57:48.191017,3d1fd49929d3a9b6b93795ea1a7f9df3
34859,PR Newswire,投融资与生态,PR新闻通讯社,https://www.prnewswire.com/il/news-releases/imc-announces-a-strategic-entry-to-the-cyber-drone-interception-and-satellite-intelligence-markets-by-signing-a-non-binding-agreement-to-acquire-51-of-blackaxe-technologies-302715975.html,"17 Mar, 2026, 14:37 ISTIMC Announces a Strategic Entry to the Cyber Drone Interception and Satellite Intelligence Markets by Signing a Non-Binding Agreement to Acquire 51% of Blackaxe TechnologiesIM Cannabis Corp. (""IMC"" or the ""Company"") (NASDAQ: IMCC), a medical cannabis company with operations in","IM Cannabis Corp. (""IMC"" or the ""Company"") (NASDAQ: IMCC), a medical cannabis company with operations in Israel and Germany, today announced that,...",,2026-03-18T07:57:48.191017,f712ca25bc08b1a1dd604790adc2286c
34860,PR Newswire,投融资与生态,PR新闻通讯社,https://www.prnewswire.com/il/news-releases/broad-adpd-2026-validation-reinforces-alzpath-ptau217-antibody-as-industry-benchmark-for-blood-based-alzheimers-diagnosis-302715896.html,"17 Mar, 2026, 14:30 ISTBroad AD/PD™ 2026 Validation Reinforces ALZpath pTau217 Antibody as Industry Benchmark for Blood-Based Alzheimer's DiagnosisALZpath, Inc., a leader in blood test-based diagnostic solutions for Alzheimer's disease, today announced the use of its proprietary pTau217 antibody ...","ALZpath, Inc., a leader in blood test-based diagnostic solutions for Alzheimer's disease, today announced the use of its proprietary pTau217 antibody ...",,2026-03-18T07:57:48.191017,841e3c8848d3c8a84bf2da9119953b42
34861,PR Newswire,投融资与生态,PR新闻通讯社,https://www.prnewswire.com/il/news-releases/cato-networks-introduces-the-industrys-first-gpu-powered-sase-platform-with-native-ai-security-302714659.html,"17 Mar, 2026, 14:30 ISTCato Networks Introduces the Industry's First GPU-Powered SASE Platform with Native AI SecurityCato Networks, the SASE leader, today unveiled two major innovations for the Cato SASE Platform to secure enterprise AI adoption at scale. Cato is...","Cato Networks, the SASE leader, today unveiled two major innovations for the Cato SASE Platform to secure enterprise AI adoption at scale. Cato is...",,2026-03-18T07:57:48.191017,b9300b99fd27cf5b2971c78761efbf9d
34862,PR Newswire,投融资与生态,PR新闻通讯社,https://www.prnewswire.com/il/news-releases/icecure-reports-2025-full-year-financial--operational-results-302715825.html,"17 Mar, 2026, 14:30 ISTIceCure Reports 2025 Full Year Financial & Operational ResultsIceCure Medical Ltd. (Nasdaq: ICCM) (""IceCure"", ""IceCure Medical"" or the ""Company""), developer of minimally-invasive cryoablation technology that...","IceCure Medical Ltd. (Nasdaq: ICCM) (""IceCure"", ""IceCure Medical"" or the ""Company""), developer of minimally-invasive cryoablation technology that...",,2026-03-18T07:57:48.191017,17f7ebd7a8bbb7e3eb78a58852e2a1c3
34863,PR Newswire,投融资与生态,PR新闻通讯社,https://www.prnewswire.com/il/news-releases/margaai-launches-the-digital-version-of-world-renowned-longevity-expert-dr-rustamova-302715938.html,"17 Mar, 2026, 14:00 ISTMarga.ai Launches the Digital Version of World-Renowned Longevity Expert Dr. RustamovaMarga.ai, the world's first platform for capturing, protecting, and scaling authentic human wisdom, announced that Dr. Shahnoz Rustamova, physician,...","Marga.ai, the world's first platform for capturing, protecting, and scaling authentic human wisdom, announced that Dr. Shahnoz Rustamova, physician,...",,2026-03-18T07:57:48.191017,947345f0ba778a14d80bec0fef0cb03f
34864,PR Newswire,投融资与生态,PR新闻通讯社,https://www.prnewswire.com/il/news-releases/just-chooses-sapiens-insurance-platform-for-life--pensions-for-system-modernisation-and-growth-302715802.html,"17 Mar, 2026, 13:00 ISTJust Chooses Sapiens Insurance Platform for Life & Pensions for System Modernisation and GrowthSapiens International Corporation N.V. (Sapiens), a leading global provider of software solutions for the insurance industry, today announced that...","Sapiens International Corporation N.V. (Sapiens), a leading global provider of software solutions for the insurance industry, today announced that...",,2026-03-18T07:57:48.191017,99c399c7d4d3c82ac160615f51056e30
34865,PR Newswire,投融资与生态,PR新闻通讯社,https://www.prnewswire.com/il/news-releases/viviomd-around-the-clock-care-for-your-weight-loss-journey-302715872.html,"17 Mar, 2026, 12:12 ISTVivioMD: Around-the-Clock Care for Your Weight Loss JourneyVivioMD, a rising leader in personalized metabolic health, announced a strategic emphasis on its ""Human Safety Net"" care model, distinguishing its...","VivioMD, a rising leader in personalized metabolic health, announced a strategic emphasis on its ""Human Safety Net"" care model, distinguishing its...",,2026-03-18T07:57:48.191017,f77615c15aff22ca6da712b30e27d77b
34866,PR Newswire,投融资与生态,PR新闻通讯社,https://www.prnewswire.com/il/news-releases/seger-surgical-solutions-achieves-milestone-with-successful-human-trials-of-laparoscopic-bowel-closure-device-302714507.html,"17 Mar, 2026, 12:09 IST/C O R R E C T I O N -- Seger Surgical Solutions/Seger Surgical Solutions Ltd. (""Seger""), a pioneer in minimally invasive surgical technology, today announced the successful completion of three...","Seger Surgical Solutions Ltd. (""Seger""), a pioneer in minimally invasive surgical technology, today announced the successful completion of three...",,2026-03-18T07:57:48.191017,bc1ff36e470dcb7570d11135ddc413d8
34867,PR Newswire,投融资与生态,PR新闻通讯社,https://www.prnewswire.com/il/news-releases/elbit-systems-reports-fourth-quarter-and-full-year-2025-results-302715788.html,"17 Mar, 2026, 10:54 ISTELBIT SYSTEMS REPORTS FOURTH QUARTER AND FULL YEAR 2025 RESULTSElbit Systems Ltd. (""Elbit Systems"" or the ""Company"") (NASDAQ: ESLT) (TASE: ESLT), the international high technology defense company, reported today...","Elbit Systems Ltd. (""Elbit Systems"" or the ""Company"") (NASDAQ: ESLT) (TASE: ESLT), the international high technology defense company, reported today...",,2026-03-18T07:57:48.191017,14d5dd5486551e9a252636479426f703
34868,PR Newswire,投融资与生态,PR新闻通讯社,https://www.prnewswire.com/il/news-releases/lx-pantos-accelerates-global-expansion-with-acquisition-of-logistics-center-in-poland-302714363.html,"17 Mar, 2026, 09:00 ISTLX Pantos Accelerates Global Expansion with Acquisition of Logistics Center in PolandLX Pantos, a leading global logistics company (Global CEO: Lee Yong-ho), is accelerating its global expansion through strategic partnerships and...","LX Pantos, a leading global logistics company (Global CEO: Lee Yong-ho), is accelerating its global expansion through strategic partnerships and...",,2026-03-18T07:57:48.191017,4a06367c8f54dd18830881f16d81c001
