ID,信息源,大类,子类,URL,标题,摘要,发布日期,采集时间,哈希
6102,MIT Technology Review,专业媒体与通讯,科技与商业媒体,https://www.technologyreview.com/,MIT Technology Review,"The human work behind humanoid robots is being hidden
In January, Nvidia’s Jensen Huang, the head of the world’s most valuable company, proclaimed that we are entering the era of [physical](https://ww",,2026-03-01T07:36:34.268872,c221928c666ccceba338081a68e30c6a
6103,欧盟AI Office,政策与监管,国际AI安全机构,https://digital-strategy.ec.europa.eu/en/news/european-union-endorses-leaders-declaration-ai-summit-india,European Union endorses Leaders' Declaration at AI Summit in India,,,2026-03-01T07:36:34.269460,2005b9a3b93a102bcee72d97cd7de025
6104,欧盟AI Office,政策与监管,国际AI安全机构,https://digital-strategy.ec.europa.eu/en/news/henna-virkkunen-and-indias-minister-external-affairs-dr-s-jaishankar-launch-european-legal-gateway,Henna Virkkunen and India’s Minister of External Affairs Dr. S Jaishankar to launch the European Legal Gateway Office in India for ICT professionals and students,,,2026-03-01T07:36:34.269460,0a569143862bd66d8d5e6e4624cd67c9
6105,欧盟AI Office,政策与监管,国际AI安全机构,https://digital-strategy.ec.europa.eu/en/news/commission-launches-investigation-shein-under-digital-services-act,Commission launches investigation into Shein under the Digital Services Act,,,2026-03-01T07:36:34.269460,9dd66e286fdf7319d0c275ecd519f1f1
6106,欧盟AI Office,政策与监管,国际AI安全机构,https://digital-strategy.ec.europa.eu/en/news/fourth-roundtable-civil-society-organisations-implementation-digital-services-act,Fourth roundtable with Civil Society Organisations on the implementation of the Digital Services Act,"On 27 February 2026, the Commission hosted a roundtable with a diverse group of Civil Society Organisations (CSOs) to provide mutual updates.",,2026-03-01T07:36:34.269460,af5ffb1a4746527cc68e3870aa1ecd2c
6107,欧盟AI Office,政策与监管,国际AI安全机构,https://digital-strategy.ec.europa.eu/en/news/commission-invites-comments-draft-new-state-aid-general-block-exemption-regulation,Commission invites comments on draft new State aid General Block Exemption Regulation,The European Commission has today launched a public consultation on the draft of a simpler and more streamlined General Block Exemption Regulation (GBER). The new version will align the GBER with curr,,2026-03-01T07:36:34.269460,245cd847421b32820952730be361b525
6108,欧盟AI Office,政策与监管,国际AI安全机构,https://digital-strategy.ec.europa.eu/en/news/protecteu-commission-presents-new-counterterrorism-agenda,ProtectEU: Commission presents new counterterrorism agenda,"The European Commission has presented a new agenda to prevent and counter terrorism, setting out the way forward to reinforce Europe's collective response to evolving terrorist and violent extremist t",,2026-03-01T07:36:34.269460,d2075cedfaaac7ed75202a03e16c0ec8
6109,欧盟AI Office,政策与监管,国际AI安全机构,https://digital-strategy.ec.europa.eu/en/news/roam-home-commission-proposes-open-negotiations-extend-eu-roaming-western-balkans,‘Roam Like at Home': Commission proposes to open negotiations to extend EU Roaming to the Western Balkans,"The European Commission has proposed to open negotiations with Albania, Bosnia and Herzegovina, Kosovo, Montenegro, North Macedonia and Serbia to integrate them into the EU's ‘Roam Like at Home' regim",,2026-03-01T07:36:34.269460,428e3dc0eb353ec4eb0173af550da5bb
6110,欧盟AI Office,政策与监管,国际AI安全机构,https://digital-strategy.ec.europa.eu/en/news/working-groups-advance-discussions-transparency-obligations-under-article-50-ai-act,Working Groups advance discussions on transparency obligations under Article 50 of the AI Act,The AI Office convened a series of meetings and workshops to collect stakeholder feedback on the first draft of the forthcoming Code of Practice on Marking and Labelling of AI-Generated Content.,,2026-03-01T07:36:34.269460,85712cfd263f12fdaf8ae73a8fb3182c
6111,欧盟AI Office,政策与监管,国际AI安全机构,https://digital-strategy.ec.europa.eu/en/news/eu-cyber-census-2025,EU Cyber Census 2025,"Facing a growing threat to its security, including in cyberspace, the EU Member States need to act together for stronger cyber defence capabilities and cooperation, in line with the Joint Communicatio",,2026-03-01T07:36:34.269460,af51979baddb513ee8138dacacbd68ee
6112,欧盟AI Office,政策与监管,国际AI安全机构,https://digital-strategy.ec.europa.eu/en/news/european-ai-innovation-month-save-date,European AI Innovation Month - Save the date,A coordinated series of European events on AI innovation will take place between mid-October and mid-November 2026.,,2026-03-01T07:36:34.269460,8921ad250ea42608be73c980dc586e2b
6113,欧盟AI Office,政策与监管,国际AI安全机构,https://digital-strategy.ec.europa.eu/en/news/executive-vice-president-virkkunen-india-summit-artificial-intelligence,Executive Vice-President Virkkunen in India for summit on artificial intelligence,"From tomorrow to Friday, Executive Vice-President for Tech Sovereignty, Security and Democracy, Henna Virkkunen, will represent the European Union at the AI Impact Summit 2026 in New Delhi.",,2026-03-01T07:36:34.269460,94d1e5ba98922fd5696d8caa73301513
6114,欧盟AI Office,政策与监管,国际AI安全机构,https://digital-strategy.ec.europa.eu/en/news/hadea-looking-expert-evaluators-fields-ai-robotics-and-sensing-technologies,"HaDEA is looking for expert evaluators in the fields of AI, robotics and sensing technologies","HaDEA, the European Health and Digital Executive Agency, is seeking experts with strong scientific, technical and industrial backgrounds on the subjects of sensing technologies, AI agents, and intelli",,2026-03-01T07:36:34.269460,617f9232e6548474ad803727cf7bfcc0
6115,欧盟AI Office,政策与监管,国际AI安全机构,https://digital-strategy.ec.europa.eu/en/news/two-years-digital-services-act-allows-50-million-content-moderation-decisions-platforms-be-reversed,Two years of Digital Services Act allows 50 million content moderation decisions by platforms to be reversed,"In just two years, online platforms have reversed almost 50 million decisions affecting users’ content or accounts, helping users exercise their Digital Services Act (DSA) rights online in the EU.",,2026-03-01T07:36:34.269460,1d0dfc1180a1efe3522963c6d3801a9e
6116,机器之心,专业媒体与通讯,中文快速聚合,https://www.jiqizhixin.com/,机器之心,"机器之心·PRO通讯会员
一份让您从此不再担心错失
AI
赛道良机的业内通讯
会员通讯
Week 09 · Kimi 与 Minimax 分别发布「Claw」产品；OpenAI 与五角大楼达成模型部署协议......
本周，Anthropic 收购视觉 AI 创企 Vercept；谷歌 Gemini 大模型升级至 3.1 Pro 版本 。
订阅会员畅读
专题解读
380
Anthropic 如何用",,2026-03-01T07:36:34.269060,31a81a7348e2a433472d384b1c9f8a97
6117,Techmeme,专业媒体与通讯,新闻聚合,https://openai.com/,OpenAI,,,2026-03-01T07:36:34.270490,0a723b7d0ef2b38fc6f9b3046b5003c6
6118,Techmeme,专业媒体与通讯,新闻聚合,https://economictimes.indiatimes.com/tech/artificial-intelligence/any-breach-of-contract-could-trigger-a-termination-openais-layered-protections-in-us-defence-department-pact/articleshow/128905640.cms,Reuters,,,2026-03-01T07:36:34.270490,633eeb2afe80621fa777d91e9f36a08a
6119,Techmeme,专业媒体与通讯,新闻聚合,https://www.forbes.com/sites/geruiwang/2026/02/28/why-ai-safety-the-dilemma-of-profits-vs-guardrails/,Forbes,,,2026-03-01T07:36:34.270490,3442f0190af3cd93e7ed7e20503ad6c3
6120,Techmeme,专业媒体与通讯,新闻聚合,https://www.bloomberg.com/news/articles/2026-02-28/openai-gives-pentagon-access-to-models-after-anthropic-dustup,Bloomberg,,,2026-03-01T07:36:34.270490,25c8e7475aa891bc00a7c8f37840acfc
6121,Techmeme,专业媒体与通讯,新闻聚合,https://www.rohan-paul.com/p/openai-sweeps-in-to-ink-deal-with,Rohan's Bytes,,,2026-03-01T07:36:34.270490,1845823bd04f248ce9977a8cc403d846
6122,Techmeme,专业媒体与通讯,新闻聚合,https://www.digitimes.com/news/a20260301VL202.html,DigiTimes,,,2026-03-01T07:36:34.270490,637525af7cceec199c65976471b2c64d
6123,Techmeme,专业媒体与通讯,新闻聚合,https://www.engadget.com/ai/openai-strikes-a-deal-with-the-defense-department-to-deploy-its-ai-models-054441785.html,Engadget,,,2026-03-01T07:36:34.270490,fc667cb56ea3c443482719dbeb3ca4d5
6124,Techmeme,专业媒体与通讯,新闻聚合,https://www.cbsnews.com/sanfrancisco/news/trump-anthropic-ai-order-federal-agencies/,CBS News,,,2026-03-01T07:36:34.270490,2eb27b74744ed5ac96882925ff725fec
6125,Techmeme,专业媒体与通讯,新闻聚合,https://www.morningstar.com/news/marketwatch/20260228157/trump-blacklists-anthropic-and-openai-swoops-in,Dow Jones Newswires,,,2026-03-01T07:36:34.270490,fa3563425a5348efa983534c998d1812
6126,Techmeme,专业媒体与通讯,新闻聚合,https://www.newsmax.com/newsfront/anthropic-guardrails-openai/2026/02/28/id/1247795/,NewsMax.com,,,2026-03-01T07:36:34.270490,cda34de9c0080da02da37fedffd8bff3
6127,Techmeme,专业媒体与通讯,新闻聚合,https://www.techinasia.com/news/openai-agrees-to-deploy-ai-models-on-pentagon-network,Tech in Asia,,,2026-03-01T07:36:34.270490,e4782fad697ed0473ae78048fe79e401
6128,Techmeme,专业媒体与通讯,新闻聚合,https://x.com/uswremichael/status/2027862789415723147,@uswremichael,,,2026-03-01T07:36:34.270490,a0248483f833e5226570f34f5cf46002
6129,Techmeme,专业媒体与通讯,新闻聚合,https://x.com/deredleritt3r/status/2027860115961905327,@deredleritt3r,,,2026-03-01T07:36:34.270490,399e4d8bdf131ca390c2bc8d182d2d54
6130,Techmeme,专业媒体与通讯,新闻聚合,https://x.com/amasad/status/2027855830612382157,@amasad,,,2026-03-01T07:36:34.270490,a7132224a0d9aeb7309a38625f79dc25
6131,Techmeme,专业媒体与通讯,新闻聚合,https://x.com/captgouda24/status/2027852630542663883,@captgouda24,,,2026-03-01T07:36:34.270490,78f63421ae644388726da3a30c62b47c
6132,Techmeme,专业媒体与通讯,新闻聚合,https://x.com/arozenshtein/status/2027867469503951297,@arozenshtein,,,2026-03-01T07:36:34.270490,21e2ff28951952a6d18a7e81ad7df6ab
6133,Techmeme,专业媒体与通讯,新闻聚合,https://x.com/zeffmax/status/2027846605626609890,@zeffmax,,,2026-03-01T07:36:34.270490,484ddc8b9fb9489772b327043d1a5548
6134,EU AI Act,政策与监管,欧盟政策来源,https://digital-strategy.ec.europa.eu/en/news/european-union-endorses-leaders-declaration-ai-summit-india,European Union endorses Leaders' Declaration at AI Summit in India,,,2026-03-01T07:36:34.269915,2005b9a3b93a102bcee72d97cd7de025
6135,EU AI Act,政策与监管,欧盟政策来源,https://digital-strategy.ec.europa.eu/en/news/henna-virkkunen-and-indias-minister-external-affairs-dr-s-jaishankar-launch-european-legal-gateway,Henna Virkkunen and India’s Minister of External Affairs Dr. S Jaishankar to launch the European Legal Gateway Office in India for ICT professionals and students,,,2026-03-01T07:36:34.269915,0a569143862bd66d8d5e6e4624cd67c9
6136,EU AI Act,政策与监管,欧盟政策来源,https://digital-strategy.ec.europa.eu/en/news/commission-launches-investigation-shein-under-digital-services-act,Commission launches investigation into Shein under the Digital Services Act,,,2026-03-01T07:36:34.269915,9dd66e286fdf7319d0c275ecd519f1f1
6137,EU AI Act,政策与监管,欧盟政策来源,https://digital-strategy.ec.europa.eu/en/news/fourth-roundtable-civil-society-organisations-implementation-digital-services-act,Fourth roundtable with Civil Society Organisations on the implementation of the Digital Services Act,"On 27 February 2026, the Commission hosted a roundtable with a diverse group of Civil Society Organisations (CSOs) to provide mutual updates.",,2026-03-01T07:36:34.269915,af5ffb1a4746527cc68e3870aa1ecd2c
6138,EU AI Act,政策与监管,欧盟政策来源,https://digital-strategy.ec.europa.eu/en/news/commission-invites-comments-draft-new-state-aid-general-block-exemption-regulation,Commission invites comments on draft new State aid General Block Exemption Regulation,The European Commission has today launched a public consultation on the draft of a simpler and more streamlined General Block Exemption Regulation (GBER). The new version will align the GBER with curr,,2026-03-01T07:36:34.269915,245cd847421b32820952730be361b525
6139,EU AI Act,政策与监管,欧盟政策来源,https://digital-strategy.ec.europa.eu/en/news/protecteu-commission-presents-new-counterterrorism-agenda,ProtectEU: Commission presents new counterterrorism agenda,"The European Commission has presented a new agenda to prevent and counter terrorism, setting out the way forward to reinforce Europe's collective response to evolving terrorist and violent extremist t",,2026-03-01T07:36:34.269915,d2075cedfaaac7ed75202a03e16c0ec8
6140,EU AI Act,政策与监管,欧盟政策来源,https://digital-strategy.ec.europa.eu/en/news/roam-home-commission-proposes-open-negotiations-extend-eu-roaming-western-balkans,‘Roam Like at Home': Commission proposes to open negotiations to extend EU Roaming to the Western Balkans,"The European Commission has proposed to open negotiations with Albania, Bosnia and Herzegovina, Kosovo, Montenegro, North Macedonia and Serbia to integrate them into the EU's ‘Roam Like at Home' regim",,2026-03-01T07:36:34.269915,428e3dc0eb353ec4eb0173af550da5bb
6141,EU AI Act,政策与监管,欧盟政策来源,https://digital-strategy.ec.europa.eu/en/news/working-groups-advance-discussions-transparency-obligations-under-article-50-ai-act,Working Groups advance discussions on transparency obligations under Article 50 of the AI Act,The AI Office convened a series of meetings and workshops to collect stakeholder feedback on the first draft of the forthcoming Code of Practice on Marking and Labelling of AI-Generated Content.,,2026-03-01T07:36:34.269915,85712cfd263f12fdaf8ae73a8fb3182c
6142,EU AI Act,政策与监管,欧盟政策来源,https://digital-strategy.ec.europa.eu/en/news/eu-cyber-census-2025,EU Cyber Census 2025,"Facing a growing threat to its security, including in cyberspace, the EU Member States need to act together for stronger cyber defence capabilities and cooperation, in line with the Joint Communicatio",,2026-03-01T07:36:34.269915,af51979baddb513ee8138dacacbd68ee
6143,EU AI Act,政策与监管,欧盟政策来源,https://digital-strategy.ec.europa.eu/en/news/european-ai-innovation-month-save-date,European AI Innovation Month - Save the date,A coordinated series of European events on AI innovation will take place between mid-October and mid-November 2026.,,2026-03-01T07:36:34.269915,8921ad250ea42608be73c980dc586e2b
6144,EU AI Act,政策与监管,欧盟政策来源,https://digital-strategy.ec.europa.eu/en/news/executive-vice-president-virkkunen-india-summit-artificial-intelligence,Executive Vice-President Virkkunen in India for summit on artificial intelligence,"From tomorrow to Friday, Executive Vice-President for Tech Sovereignty, Security and Democracy, Henna Virkkunen, will represent the European Union at the AI Impact Summit 2026 in New Delhi.",,2026-03-01T07:36:34.269915,94d1e5ba98922fd5696d8caa73301513
6145,EU AI Act,政策与监管,欧盟政策来源,https://digital-strategy.ec.europa.eu/en/news/hadea-looking-expert-evaluators-fields-ai-robotics-and-sensing-technologies,"HaDEA is looking for expert evaluators in the fields of AI, robotics and sensing technologies","HaDEA, the European Health and Digital Executive Agency, is seeking experts with strong scientific, technical and industrial backgrounds on the subjects of sensing technologies, AI agents, and intelli",,2026-03-01T07:36:34.269915,617f9232e6548474ad803727cf7bfcc0
6146,EU AI Act,政策与监管,欧盟政策来源,https://digital-strategy.ec.europa.eu/en/news/two-years-digital-services-act-allows-50-million-content-moderation-decisions-platforms-be-reversed,Two years of Digital Services Act allows 50 million content moderation decisions by platforms to be reversed,"In just two years, online platforms have reversed almost 50 million decisions affecting users’ content or accounts, helping users exercise their Digital Services Act (DSA) rights online in the EU.",,2026-03-01T07:36:34.269915,1d0dfc1180a1efe3522963c6d3801a9e
6147,EU AI Act,政策与监管,欧盟政策来源,https://digital-strategy.ec.europa.eu/en/library/action-plan-against-cyberbullying,Action Plan against cyberbullying,,,2026-03-01T07:36:34.269915,d7b60bb22cc27815d51099cc10ba31ec
6148,EU AI Act,政策与监管,欧盟政策来源,https://digital-strategy.ec.europa.eu/en/library/proposal-regulation-digital-networks-act-dna,Proposal for a Regulation for the Digital Networks Act (DNA),,,2026-03-01T07:36:34.269915,e77f34e96565f512df132c10b331a747
6149,EU AI Act,政策与监管,欧盟政策来源,https://digital-strategy.ec.europa.eu/en/library/proposal-directive-regards-simplification-measures-and-alignment-cybersecurity-act,Proposal for a Directive as regards simplification measures and alignment with the Cybersecurity Act,,,2026-03-01T07:36:34.269915,7125574fb8878c74c5379dce6f147476
6150,EU AI Act,政策与监管,欧盟政策来源,https://digital-strategy.ec.europa.eu/en/library/mobile-and-fixed-broadband-price-europe-2024-insights-european-broadband-market,Mobile and fixed broadband price in Europe in 2024: Insights into the European Broadband Market,"In 2024, prices for fixed broadband services fell by an average of 5% while prices for mobile internet services dropped by 14% compared to 2023.",,2026-03-01T07:36:34.269915,cf2a69b51f0c8e44825a738be1a1c42d
6151,EU AI Act,政策与监管,欧盟政策来源,https://digital-strategy.ec.europa.eu/en/library/stronger-cybersecurity-interconnected-world,Stronger cybersecurity in an interconnected world,The EU-funded TELEMETRY project is developing reliable tools to detect cyber threats and vulnerabilities in Internet of things ecosystems.,,2026-03-01T07:36:34.269915,a85688d48a4efba14ef9c5fd595e6a32
6152,EU AI Act,政策与监管,欧盟政策来源,https://digital-strategy.ec.europa.eu/en/library/results-study-interoperability-data-processing-services,Results of the study on interoperability of data processing services,This study aims to assist the Commission in establishing a Union repository and to prepare for the publication of the first batch of open specifications and harmonised standards that meet the requirem,,2026-03-01T07:36:34.269915,277cbcb957b18b0d99ec4efb81504a42
6153,EU AI Act,政策与监管,欧盟政策来源,https://digital-strategy.ec.europa.eu/en/library/study-supporting-evaluation-berec-and-berec-office,Study supporting the evaluation of BEREC and the BEREC office,The goal of this study is to support the Commission’s evaluation of the performance of BEREC and the BEREC Office.,,2026-03-01T07:36:34.269915,af6accc018e107c5710de459ed6736b2
6154,EU AI Act,政策与监管,欧盟政策来源,https://digital-strategy.ec.europa.eu/en/library/leaders-declaration-ai-impact-summit-india,Leaders’ Declaration at AI Impact Summit in India,"The AI Impact Summit 2026, held in New Delhi on 18–19 February, concluded with the adoption of the New Delhi Declaration on AI Impact, marking a significant milestone in global cooperation on artifici",,2026-03-01T07:36:34.269915,ef6b8eb0739b0fa2a4134d4b8e3947d8
6155,EU AI Act,政策与监管,欧盟政策来源,https://digital-strategy.ec.europa.eu/en/library/horizon-europe-info-days-2026-cluster-4-recordings-available,Horizon Europe Info Days 2026 on Cluster 4 - recordings available,"Speakers from the European Commission presented detailed information on the call topics, as well as the evaluation and award procedures.",,2026-03-01T07:36:34.269915,5e10fd8a5e6f296e7cb7edd27fe516ea
6156,EU AI Act,政策与监管,欧盟政策来源,https://digital-strategy.ec.europa.eu/en/library/toolbox-improve-ict-supply-chain-security,Toolbox to improve ICT supply chain security,"The NIS Cooperation Group composed of EU Member States representatives, the European Commission and the EU Agency for cybersecurity (ENISA), has adopted an EU ICT Supply Chain Security Toolbox.",,2026-03-01T07:36:34.269915,e565a45214a806a43498912f47781b4d
6157,EU AI Act,政策与监管,欧盟政策来源,https://digital-strategy.ec.europa.eu/en/library/infoday-genai-public-administrations-presentations-and-recording,Infoday - GenAI in public administrations - presentations and recording,Find the recording and presentations of the infoday building an ecosystem for GenAI in public administrations.,,2026-03-01T07:36:34.269915,f9d0f6d3be77e055b454ec40ff662806
6158,EU AI Act,政策与监管,欧盟政策来源,https://digital-strategy.ec.europa.eu/en/library/first-ecava-working-groups-demonstrate-industrys-willingness-collaborate-next-generation-digital,First ECAVA Working Groups demonstrate industry's willingness to collaborate on next-generation digital vehicles,"On 5-6 February, the European Commission hosted the first in-person meetings of the European Connected and Autonomous Vehicle Alliance (ECAVA) Working Groups in Brussels.",,2026-03-01T07:36:34.269915,960363a7b89de180106c87bcc056ef66
6159,EU AI Act,政策与监管,欧盟政策来源,https://digital-strategy.ec.europa.eu/en/library/action-plan-drone-and-counter-drone-security,Action Plan on Drone and Counter Drone Security,The European Commission has presented an EU Action Plan on Drone and Counter Drone Security for a united approach against threats posed by malicious drones.,,2026-03-01T07:36:34.269915,63891fcbb9ddfb49d116a9807e85912e
6160,Mistral AI,AI巨头与顶级实验室,新兴AI独角兽,https://mistral.ai/news?category=research,Voxtral transcribes at the speed of sound.,"Precision diarization, real-time transcription, and a new audio playground.",,2026-03-01T07:36:36.576060,c6a1c2533374c2ead478db1e06edad0b
6161,Apple,AI巨头与顶级实验室,AI龙头企业,https://machinelearning.apple.com/research/neurips-2025,Apple Machine Learning Research at NeurIPS 2025,"Apple Machine Learning Research at NeurIPS 2025 November 21, 2025",,2026-03-01T07:36:34.262728,223889e2410c6c4e172b8d83e1f0e4a7
6162,Apple,AI巨头与顶级实验室,AI龙头企业,https://machinelearning.apple.com/research/exploring-llms-mlx-m5,Exploring LLMs with MLX and the Neural Accelerators in the M5 GPU,"Exploring LLMs with MLX and the Neural Accelerators in the M5 GPU November 19, 2025",,2026-03-01T07:36:34.262728,b38687493fd99898245cf8c31141ff19
6163,Apple,AI巨头与顶级实验室,AI龙头企业,https://machinelearning.apple.com/research/the-super-weight,The “Super Weight:” How Even a Single Parameter can Determine a Large Language Model’s Behavior,"The “Super Weight:” How Even a Single Parameter can Determine a Large Language Model’s Behavior August 21, 2025",,2026-03-01T07:36:34.262728,748dd045fa15e8ea0b2a5a0ed034f0d1
6164,Apple,AI巨头与顶级实验室,AI龙头企业,https://machinelearning.apple.com/research/super-weight,The Super Weight in Large Language Models,"A recent paper from Apple researchers, “The Super Weight in Large Language Models,” reveals that an extremely small subset of parameters in LLMs (in some cases, a single parameter) can exert a disprop",,2026-03-01T07:36:34.262728,a18ae2e954c0e0f2a3ce30e63c560188
6165,Apple,AI巨头与顶级实验室,AI龙头企业,https://machinelearning.apple.com/research/fast-vision-language-models,FastVLM: Efficient Vision Encoding for Vision Language Models,"FastVLM: Efficient Vision Encoding for Vision Language Models July 23, 2025research areaComputer Vision",,2026-03-01T07:36:34.262728,2d260fe2a783b96addd1ce50241ae2e2
6166,Apple,AI巨头与顶级实验室,AI龙头企业,https://machinelearning.apple.com/highlights?domain=Computer%20Vision,research areaComputer Vision,"FastVLM: Efficient Vision Encoding for Vision Language Models July 23, 2025research areaComputer Vision",,2026-03-01T07:36:34.262728,9c99d85cd60c4b507a6da71198879f4a
6167,Apple,AI巨头与顶级实验室,AI龙头企业,https://machinelearning.apple.com/research/icml-2025,Apple Machine Learning Research at ICML 2025,"Apple Machine Learning Research at ICML 2025 July 11, 2025",,2026-03-01T07:36:34.262728,05a9243c1acf6acad9c347006deef0f9
6168,Apple,AI巨头与顶级实验室,AI龙头企业,https://icml.cc,International Conference on Machine Learning (ICML),"Apple researchers are advancing AI and ML through fundamental research, and to support the broader research community and help accelerate progress in this field, we share much of this research through",,2026-03-01T07:36:34.262728,bbb70f30cdec64468af9476678221a8a
6169,Apple,AI巨头与顶级实验室,AI龙头企业,https://machinelearning.apple.com/research/cvpr-2025,Apple Machine Learning Research at CVPR 2025,"Apple Machine Learning Research at CVPR 2025 June 10, 2025research areaComputer Vision,research areaMethods and AlgorithmsconferenceCVPR",,2026-03-01T07:36:34.262728,983b9bf821472a30f5c083c215f9e1b2
6170,Apple,AI巨头与顶级实验室,AI龙头企业,https://machinelearning.apple.com/highlights?domain=Methods%20and%20Algorithms,research areaMethods and Algorithms,"Apple Machine Learning Research at CVPR 2025 June 10, 2025research areaComputer Vision,research areaMethods and AlgorithmsconferenceCVPR",,2026-03-01T07:36:34.262728,ad338e735b1fc04ed92304d82ac3c8d9
6171,Apple,AI巨头与顶级实验室,AI龙头企业,https://machinelearning.apple.com/highlights?event=CVPR,conferenceCVPR,"Apple Machine Learning Research at CVPR 2025 June 10, 2025research areaComputer Vision,research areaMethods and AlgorithmsconferenceCVPR",,2026-03-01T07:36:34.262728,813c9bca5ca12631a69b2d9e6592f0ad
