ID,信息源,大类,子类,URL,标题,摘要,发布日期,采集时间,哈希
34168,Amazon/AWS,AI巨头与顶级实验室,AI龙头企业,https://aws.amazon.com/blogs/aws/transform-live-video-for-mobile-audiences-with-aws-elemental-inference/,Transform live video for mobile audiences with AWS Elemental Inference,"AWS Elemental Inference is a fully managed AI service that automatically transforms live and on-demand video broadcasts into vertical formats optimized for mobile and social platforms in real time, en",,2026-03-18T07:57:20.263060,4645474ac569d8eb16218f2909f22bad
34169,Amazon/AWS,AI巨头与顶级实验室,AI龙头企业,https://aws.amazon.com/blogs/big-data/building-a-scalable-transactional-data-lake-using-dbt-amazon-emr-and-apache-iceberg/,"Building a scalable, transactional data lake using dbt, Amazon EMR, and Apache Iceberg","Growing data volume, variety, and velocity has made it crucial for businesses to implement architectures that efficiently manage and analyze data, while maintaining data integrity and consistency. In ",,2026-03-18T07:57:20.263060,9c644bb3457d947e9e523101bf1f8d73
34170,Amazon/AWS,AI巨头与顶级实验室,AI龙头企业,https://aws.amazon.com/blogs/big-data/securely-connect-kafka-clients-running-outside-aws-to-amazon-msk-with-iam-roles-anywhere/,Securely connect Kafka clients running outside AWS to Amazon MSK with IAM Roles Anywhere,"In this post, we demonstrate how to use AWS IAM Roles Anywhere to request temporary AWS security credentials, using x.509 certificates for client applications which enables secure interactions with an",,2026-03-18T07:57:20.263060,75adc9e33af669907f1c30135b5131a9
34171,Amazon/AWS,AI巨头与顶级实验室,AI龙头企业,https://aws.amazon.com/blogs/big-data/amazon-redshift-dc2-migration-approach-with-a-customer-case-study/,Amazon Redshift DC2 migration approach with a customer case study,"In this post, we share insights from one of our customers’ migration from DC2 to RA3 instances. The customer, a large enterprise in the retail industry, operated a 16-node dc2.8xlarge cluster for busi",,2026-03-18T07:57:20.263060,5995c952eef1e9e75f40a84d1f532e71
34172,Amazon/AWS,AI巨头与顶级实验室,AI龙头企业,https://aws.amazon.com/blogs/big-data/reducing-costs-for-shuffle-heavy-apache-spark-workloads-with-serverless-storage-for-amazon-emr-serverless/,Reducing costs for shuffle-heavy Apache Spark workloads with serverless storage for Amazon EMR Serverless,"In this post, we explore the cost improvements we observed when benchmarking Apache Spark jobs with serverless storage on EMR Serverless. We take a deeper look at how serverless storage helps reduce c",,2026-03-18T07:57:20.263060,559ada8f307a6f339a232940ace21689
34173,Amazon/AWS,AI巨头与顶级实验室,AI龙头企业,https://aws.amazon.com/blogs/big-data/optimize-hbase-reads-with-bucket-caching-on-amazon-emr/,Optimize HBase reads with bucket caching on Amazon EMR,"In this post, we demonstrate how to improve HBase read performance by implementing bucket caching on Amazon EMR. Our tests reduced latency by 57.9% and improved throughput by 138.8%. This solution is ",,2026-03-18T07:57:20.263060,fffbfb30d948cf53a9a864335dc922b1
34174,Amazon/AWS,AI巨头与顶级实验室,AI龙头企业,https://aws.amazon.com/blogs/big-data/kinesis-on-demand-advantage-saves-60-on-streaming-costs/,Kinesis On-demand Advantage saves 60%+ on streaming costs,"On November 4, 2025, Amazon Kinesis Data Streams introduced On-demand Advantage mode, a capability that enables on-demand streams to handle instant throughput increases at scale and cost optimization ",,2026-03-18T07:57:20.263060,97928f4b80763df5827f71a58c530e72
34175,Amazon/AWS,AI巨头与顶级实验室,AI龙头企业,https://aws.amazon.com/blogs/big-data/how-razorpay-achieved-11-performance-improvement-and-21-cost-reduction-with-amazon-emr/,How Razorpay achieved 11% performance improvement and 21% cost reduction with Amazon EMR,"In this post, we explore how Razorpay, India’s leading FinTech company, transformed their data platform by migrating from a third-party solution to Amazon EMR, unlocking improved performance and signi",,2026-03-18T07:57:20.263060,2ae4051671cc127436b7aa02b2e69d09
34176,Amazon/AWS,AI巨头与顶级实验室,AI龙头企业,https://aws.amazon.com/blogs/big-data/how-amplitude-implemented-natural-language-powered-analytics-using-amazon-opensearch-service-as-a-vector-database/,How Amplitude implemented natural language-powered analytics using Amazon OpenSearch Service as a vector database,Amplitude is a product and customer journey analytics platform. Our customers wanted to ask deep questions about their product usage. Ask Amplitude is an AI assistant that uses large language models (,,2026-03-18T07:57:20.263060,4fcaa9bb15c7eb541ab9327a1b01bed2
34177,Amazon/AWS,AI巨头与顶级实验室,AI龙头企业,https://aws.amazon.com/blogs/big-data/zero-etl-integrations-with-amazon-opensearch-service/,Zero-ETL integrations with Amazon OpenSearch Service,"OpenSearch Service offers zero-ETL integrations with other Amazon Web Service (AWS) services, enabling seamless data access and analysis without the need for maintaining complex data pipelines. Zero-E",,2026-03-18T07:57:20.263060,060dbed1766645652ef5deb5f00ac8c5
34178,Amazon/AWS,AI巨头与顶级实验室,AI龙头企业,https://aws.amazon.com/blogs/big-data/building-a-modern-lakehouse-architecture-yggdrasil-gamings-journey-from-bigquery-to-aws/,Building a modern lakehouse architecture: Yggdrasil Gaming’s journey from BigQuery to AWS,"Yggdrasil Gaming develops and publishes casino games globally, processing massive amounts of real-time gaming data for game performance analytics, player behavior insights, and industry intelligence. ",,2026-03-18T07:57:20.263060,6ac5857786213e021f0a6df939685e9b
34179,Amazon/AWS,AI巨头与顶级实验室,AI龙头企业,https://www.amazon.science/publications,Publications,Prime Video is a first-stop entertainment destination offering customers a vast collection of premium programming in one app available across thousands of devices. Prime members can customize their vi,2026,2026-03-18T07:57:20.263060,1966325253a336b34fd9f5244c7f2571
34180,Amazon/AWS,AI巨头与顶级实验室,AI龙头企业,https://www.amazon.science/research-areas/machine-learning,Machine Learning,Prime Video is a first-stop entertainment destination offering customers a vast collection of premium programming in one app available across thousands of devices. Prime members can customize their vi,2026,2026-03-18T07:57:20.263060,6a66e8b017ace6e5ace0b35ba7d65f6a
34181,Amazon/AWS,AI巨头与顶级实验室,AI龙头企业,https://www.amazon.science/blog,Blog,Prime Video is a first-stop entertainment destination offering customers a vast collection of premium programming in one app available across thousands of devices. Prime members can customize their vi,"March 16, 2026",2026-03-18T07:57:20.263060,dffda614ce877ce8f8db8d944a5640be
34182,Amazon/AWS,AI巨头与顶级实验室,AI龙头企业,https://www.amazon.science/news,News,Prime Video is a first-stop entertainment destination offering customers a vast collection of premium programming in one app available across thousands of devices. Prime members can customize their vi,"February 4, 2026",2026-03-18T07:57:20.263060,b0e93dd7f2bc032ca6f90e3fdb364a0c
34183,Nature Machine Intelligence,高校与研究机构,学术期刊,https://www.nature.com/articles/s42256-026-01208-w,LLMs displaying less cognitive bias are not necessarily better decision makers,"Large language models (LLMs) include not only social stereotypes but also cognitive biases. As researchers work to identify, characterize and rectify these biases, we encourage the scientific communit",2026-03-17,2026-03-18T07:57:27.791344,f26f7ea01228c67bda2901c885254ee1
34184,Nature Machine Intelligence,高校与研究机构,学术期刊,https://www.nature.com/articles/s42256-026-01207-x,The case for stakeholder-driven AI auditing in automatic speech recognition,,2026-03-16,2026-03-18T07:57:27.791344,87c5a3ffbf244461c401cfb1f63abf6c
34185,Nature Machine Intelligence,高校与研究机构,学术期刊,https://www.nature.com/articles/s42256-026-01203-1,AI and the long game,"Almost 10 years ago, AlphaGo defeated one of the world’s best professional players in the complex, ancient game of Go. It was a pivotal moment that spawned new research directions and marked the begin",2026-02-24,2026-03-18T07:57:27.791344,9d1c7d98d66911694d75ea9be8bbbdf6
34186,Nature Machine Intelligence,高校与研究机构,学术期刊,https://www.nature.com/articles/s42256-026-01193-0,Attributing and situating knowledge cannot be left to language models,,2026-02-06,2026-03-18T07:57:27.791344,a16afaca84159a9df250bfc4dcc07154
34187,Nature Machine Intelligence,高校与研究机构,学术期刊,https://www.nature.com/articles/s42256-025-01171-y,Authorization of prognostic AI medical devices,"Less than 2% of artificial intelligence devices authorized by the US Food and Drug Agency are prognostic, with prediction horizons ranging from minutes to several years. As the number of prognostic AI",2026-02-06,2026-03-18T07:57:27.791344,bbd037783f38011fa35309ba361c0bc5
34188,Nature Machine Intelligence,高校与研究机构,学术期刊,https://www.nature.com/articles/s42256-026-01178-z,On the troubling rise of generative AI suspicion in academic publishing,,2026-01-30,2026-03-18T07:57:27.791344,7f23d497e6023e0c678e4571bc6efe75
34189,Nature Machine Intelligence,高校与研究机构,学术期刊,https://www.nature.com/articles/s42256-026-01183-2,Multi-agent AI systems need transparency,"Agentic artificial intelligence (AI) frameworks are in vogue. However, implementing such systems in scientific research workflows requires clear motivations and explanations, given the risk of wasting",2026-01-27,2026-03-18T07:57:27.791344,4d73aa3bfdf46e7173a2c8b8df1984b2
34190,Nature Machine Intelligence,高校与研究机构,学术期刊,https://www.nature.com/articles/s42256-025-01159-8,LLM use in scholarly writing poses a provenance problem,,2025-12-12,2026-03-18T07:57:27.791344,29fa07ea90a83e5a5c2ab781954ffa9e
34191,Nature Machine Intelligence,高校与研究机构,学术期刊,https://www.nature.com/articles/s42256-025-01144-1,South Asian biases in language and vision models,"Biases in artificial intelligence models have been studied predominantly through Western lenses, overlooking South Asia’s unique contexts of caste, religion, colourism and representation. This Comment",2025-11-13,2026-03-18T07:57:27.791344,8c535b68f8e1c2a19634d110fdd095dd
34192,Nature Machine Intelligence,高校与研究机构,学术期刊,https://www.nature.com/articles/s42256-025-01139-y,Are neural network representations universal or idiosyncratic?,"Questions over whether neural networks learn universal or model-specific representations framed a community event at the Cognitive Computational Neuroscience conference in August 2025, highlighting fu",2025-10-21,2026-03-18T07:57:27.791344,3fdc385d823ee4c7e9fabc351461475d
34193,Nature Machine Intelligence,高校与研究机构,学术期刊,https://www.nature.com/articles/s42256-025-01138-z,A cautiously optimistic view on large language model use against linguistic injustice in academia,,2025-10-16,2026-03-18T07:57:27.791344,98871a6457cd7cf7a7479165183ca2ed
34194,Nature Machine Intelligence,高校与研究机构,学术期刊,https://www.nature.com/articles/s42256-025-01134-3,Foundation models’ acceptable use policies disregard the environment and nature,,2025-10-16,2026-03-18T07:57:27.791344,33b28aae58240fedca50abee740b6cc0
34195,Nature Machine Intelligence,高校与研究机构,学术期刊,https://www.nature.com/articles/s42256-025-01123-6,Rethinking human roles in AI warfare,Most policy proposals aimed at managing the risks of artificial intelligence (AI)-enabled weapons rely heavily on meaningful human control or appropriate human judgment for risk mitigation. This Comme,2025-10-13,2026-03-18T07:57:27.791344,fe31a6bae0a8976a8a63eae38bf676c8
34196,Nature Machine Intelligence,高校与研究机构,学术期刊,https://www.nature.com/articles/s42256-025-01132-5,Insights from the Road Damage Detection Challenge Series (2018–2024),"The organizers reflect on how a multi-year, multi-country benchmark aligned AI research in road damage detection with practical and regional constraints, steering it towards deployment relevance.",2025-10-13,2026-03-18T07:57:27.791344,dc07dbd1b777093ca8ac6787aa7c3a5a
34197,Nature Machine Intelligence,高校与研究机构,学术期刊,https://www.nature.com/articles/s42256-025-01114-7,Towards reproducible robotics research,,2025-09-23,2026-03-18T07:57:27.791344,091aaa272cfe8a8da6fe554e57dffdca
34198,Nature Machine Intelligence,高校与研究机构,学术期刊,https://www.nature.com/articles/s42256-025-01110-x,Towards agentic science for advancing scientific discovery,"Artificial intelligence is transforming scientific discovery through (semi-)autonomous agents capable of reasoning, planning, and interacting with digital and physical environments. This Comment explo",2025-09-10,2026-03-18T07:57:27.791344,05a117fcb508989f6afd41cccfb42f7e
34199,Nature Machine Intelligence,高校与研究机构,学术期刊,https://www.nature.com/articles/s42256-025-01108-5,Applying genomic AI to combat antibiotic resistance in low-income countries,,2025-09-04,2026-03-18T07:57:27.791344,964629d2635082c91160660a950d21ca
34200,Nature Machine Intelligence,高校与研究机构,学术期刊,https://www.nature.com/articles/s42256-025-01101-y,LLMs as all-in-one tools to easily generate publication-ready citation diversity reports,,2025-08-25,2026-03-18T07:57:27.791344,c65d9a3bfe85513e17dd22b7122ffa91
34201,Nature Machine Intelligence,高校与研究机构,学术期刊,https://www.nature.com/articles/s42256-025-01106-7,Towards responsible geospatial foundation models,"Recent years have seen a surge in geospatial artificial intelligence models, with promising applications in ecological and environmental monitoring tasks. Further work should also focus on the sustain",2025-08-20,2026-03-18T07:57:27.791344,934742b0f399f151c951b2c0ee162cf0
34202,Nature Machine Intelligence,高校与研究机构,学术期刊,https://www.nature.com/articles/s42256-025-01093-9,Emotional risks of AI companions demand attention,The integration of AI into mental health and wellness domains has outpaced regulation and research.,2025-07-22,2026-03-18T07:57:27.791344,62a325d648347cf50790a11d0daba60f
34203,Nature Machine Intelligence,高校与研究机构,学术期刊,https://www.nature.com/articles/s42256-026-01200-4,Sample-efficient generative molecular design using memory manipulation,Guo et al. train a Mamba-based language model for molecule generation and find that data augmentation and experience replay can enable the efficient generation of property-optimized small molecules.,2026-03-17,2026-03-18T07:57:27.791344,2df56fb946236cefeec05e5415c6fcd9
34204,Nature Machine Intelligence,高校与研究机构,学术期刊,https://www.nature.com/articles/s42256-026-01202-2,Predicting and interpreting cell-type-specific drug responses in the small-data regime using inductive priors,"Alsulami et al. present PrePR-CT, a computational approach that predicts how different cell types respond to drug-like compounds using limited data. By integrating biological networks with machine lea",2026-03-16,2026-03-18T07:57:27.791344,fd3faf6222633f8ea7f1b0be8b63c688
34205,Nature Machine Intelligence,高校与研究机构,学术期刊,https://www.nature.com/articles/s42256-026-01186-z,A robot operating system framework for using large language models in embodied AI,"Mower, Wan et al. introduce ROS-LLM, an open-source system that lets non-experts control robots with natural language, learn new skills from demonstrations and feedback, and automatically tune actions",2026-03-16,2026-03-18T07:57:27.791344,7bfffe9892d04ac11a41ea277eb8fb4a
34206,Nature Machine Intelligence,高校与研究机构,学术期刊,https://www.nature.com/articles/s42256-026-01189-w,Learning collision risk proactively from naturalistic driving data at scale,Jiao et al. introduce a generalized safety measure for autonomous driving systems that learns collision risk from everyday driving without labels. It accurately warns in real time of crashes and near-,2026-03-09,2026-03-18T07:57:27.791344,25e729f17d4d277d690fa7a63ae6afb0
34207,Nature Machine Intelligence,高校与研究机构,学术期刊,https://www.nature.com/articles/s42256-026-01192-1,Reinforcement learning-based design of sequential drug treatment targeting the evolving tumour landscape with SequenTx,"Chen et al. introduce SequenTx, a virtual-cell-inspired framework for the rational design of sequential therapy. It offers a computational strategy to navigate therapy-induced tumour evolution by mode",2026-03-04,2026-03-18T07:57:27.791344,c901bc270bce735b8ab18f352c9e6c4d
34208,Nature Machine Intelligence,高校与研究机构,学术期刊,https://www.nature.com/articles/s42256-026-01196-x,A universal spin–orbit-coupled Hamiltonian model for accelerated quantum material discovery,"Zhong et al. introduce Uni-HamGNN, a graph neural network model that predicts spin–orbit-coupled electronic structures quickly and accurately, enabling fast screening and the discovery of advanced qua",2026-02-27,2026-03-18T07:57:27.791344,7f9c7a9874f2d2e6c5817f5f3931b555
34209,Nature Machine Intelligence,高校与研究机构,学术期刊,https://www.nature.com/articles/s42256-026-01199-8,A family of large language models for materials research with insights into model adaptability in continued pretraining,"Dhruv et al. introduce LLaMat, a family of LLMs for materials science, showing how specialized training enables smaller models to surpass larger general LLMs. The study reveals that extensively pretra",2026-02-27,2026-03-18T07:57:27.791344,17869049dc2ceb9b5ca0ced8b307ca79
34210,Nature Machine Intelligence,高校与研究机构,学术期刊,https://www.nature.com/articles/s42256-026-01198-9,Conditional diffusion with locality-aware modal alignment for generating diverse protein conformational ensembles,"Wang et al. introduce Mac-Diff, a conditional diffusion model with locality-aware attention across modalities, to generate diverse conformational ensembles for unseen proteins, capturing both dynamic ",2026-02-25,2026-03-18T07:57:27.791344,b6899b8014ca1da92363417b196d398c
34211,Nature Machine Intelligence,高校与研究机构,学术期刊,https://www.nature.com/articles/s42256-026-01180-5,Cardiac health assessment across scenarios and devices using a multimodal foundation model pretrained on data from 1.7 million individuals,"Gu et al. introduce a cardiac foundation model that learns from millions of heart signals and textual interpretations, enabling it to handle heart data collected either in hospitals or at home. It off",2026-02-24,2026-03-18T07:57:27.791344,b0cbb06c9f91913ea56a6817dca0e1d6
34212,Nature Machine Intelligence,高校与研究机构,学术期刊,https://www.nature.com/articles/s42256-026-01188-x,A large-scale randomized study of large language model feedback in peer review,"In a randomized controlled study at ICLR 2025, Thakkar et al. demonstrate that large language model-generated feedback can make reviews more informative while enhancing reviewer–author engagement.",2026-02-23,2026-03-18T07:57:27.791344,c9decf3d105dd2041585b38bd3e49d9a
34213,Nature Machine Intelligence,高校与研究机构,学术期刊,https://www.nature.com/articles/s42256-026-01190-3,Synthetic X‑ray‑driven tracking and control of miniature medical devices,"Wang et al. introduce MicroSyn-X, a synthetic X-ray data generation framework that overcomes data scarcity in miniature medical devices, enabling robust deep learning-based tracking and real-time robo",2026-02-23,2026-03-18T07:57:27.791344,f1fdea2f32831ea5fc544eed89ac92b4
34214,Nature Machine Intelligence,高校与研究机构,学术期刊,https://www.nature.com/articles/s42256-026-01182-3,Preconditioned inexact stochastic ADMM for deep models,"Zhou et al. develop PISA, an optimizer for deep learning models that supports heterogeneous data and various preconditions. It converges under minimal assumptions, while outperforming established meth",2026-02-20,2026-03-18T07:57:27.791344,b82dd1cfa18d0a1b38a5a61300f2484d
34215,Nature Machine Intelligence,高校与研究机构,学术期刊,https://www.nature.com/articles/s42256-025-01153-0,Meta-designing quantum experiments with language models,"Language models can write human-readable code that captures general design rules, generating whole families of quantum experiments at once. A design strategy described here makes results interpretable",2026-02-19,2026-03-18T07:57:27.791344,64838be684d486dc771c60ddc93f0eea
34216,Nature Machine Intelligence,高校与研究机构,学术期刊,https://www.nature.com/articles/s42256-026-01185-0,Parallel hierarchical encoding of linguistic representations in the human auditory cortex and recurrent automatic speech recognition systems,"Keshishian, Mischler et al. report that a recurrent automatic speech recognition system aligns closely with brain organization: model layers map to distinct cortical regions and naturally learn to enc",2026-02-17,2026-03-18T07:57:27.791344,23ed50db1c96bc69195739f31e521424
34217,Nature Machine Intelligence,高校与研究机构,学术期刊,https://www.nature.com/articles/s42256-025-01176-7,A flaw in using pretrained protein language models in protein–protein interaction inference models,"The usage of pretrained protein language models (pLMs) is rapidly growing. However, Szymborski and Emad find that pretrained pLMs can be a source of data leakage in the task of protein–protein interac",2026-02-13,2026-03-18T07:57:27.791344,d27a76992acae100ffa76a95c23316af
34218,Nature Machine Intelligence,高校与研究机构,学术期刊,https://www.nature.com/articles/s42256-026-01187-y,Reusability Report: Evaluating the performance of a meta-learning foundation model on predicting the antibacterial activity of natural products,"This Reusability Report tests the ability of a foundation model, ActFound, to predict the antibacterial activity of plant natural products. We found that although all models performed poorly on this t",2026-02-12,2026-03-18T07:57:27.791344,f53463fa598cc5fac5b9d5d6aa56a673
34219,Nature Machine Intelligence,高校与研究机构,学术期刊,https://www.nature.com/articles/s42256-025-01169-6,When large language models are reliable for judging empathic communication,Kumar et al. show that large language models (LLMs) nearly match expert reliability and outperform laypeople when assessing empathic communication across multiple frameworks. The performance of both L,2026-02-11,2026-03-18T07:57:27.791344,6f2f9a553cca26a16491ed86fcc5846b
34220,Nature Machine Intelligence,高校与研究机构,学术期刊,https://www.nature.com/articles/s42256-025-01168-7,What matters in building vision–language–action models for generalist robots,Vision–language–action models recently emerged as a tool for robotics. Here Li and colleagues compare vision–language–action models and highlight what makes a model useful.,2026-02-11,2026-03-18T07:57:27.791344,293c2c59d5f204276b891bea54f4f437
34221,Nature Machine Intelligence,高校与研究机构,学术期刊,https://www.nature.com/articles/s42256-026-01184-1,A federated graph learning method to realize multi-party collaboration for molecular discovery,"Zhang et al. introduce FedLG, a federated graph learning framework that leverages Lanczos-based projection to effectively aggregate heterogeneous molecular data. Extensive benchmarks demonstrate its r",2026-02-10,2026-03-18T07:57:27.791344,90a638e9197c55f0109ee1242f83ddfb
34222,Nature Machine Intelligence,高校与研究机构,学术期刊,https://www.nature.com/articles/s42256-026-01179-y,Visual language models show widespread visual deficits on neuropsychological tests,Tangtartharakul and Storrs use standardized neuropsychological tests to compare human visual abilities with those of visual language models (VLMs). They report that while VLMs excel in high-level obje,2026-02-06,2026-03-18T07:57:27.791344,d6bc297030727b82dc7fe13c94a14fa0
34223,Nature Machine Intelligence,高校与研究机构,学术期刊,https://www.nature.com/articles/s42256-026-01197-w,A benchmarking framework for embodied neuromorphic agents,Combining soft robotics with neuromorphic engineering is a promising approach in embodied intelligence. Giulia d’Angelo et al. contribute to progress in this field by developing a framework for benchm,2026-03-11,2026-03-18T07:57:27.791344,f9f1625a2c31ab705d21f04307b439c0
34224,Nature Machine Intelligence,高校与研究机构,学术期刊,https://www.nature.com/articles/s42256-026-01191-2,Identifying spatial single-cell-level interactions with graph transformer,Identifying cell–cell interactions from imaging-based spatial transcriptomics suffers from limited gene panels. A new self-supervised graph transformer-based method can resolve spatial single-cell-lev,2026-02-06,2026-03-18T07:57:27.791344,a504c532fb61f25a5532b7083bf54627
34225,Nature Machine Intelligence,高校与研究机构,学术期刊,https://www.nature.com/articles/s42256-026-01181-4,Teaching machines to blend electrolyte cocktails,Mixtures are ubiquitous in industrial formulations. A framework unifying predictive and generative machine learning now offers a blueprint for data-driven design of multi-component battery electrolyte,2026-01-28,2026-03-18T07:57:27.791344,93f58b0da01916f5ce55828e1423ec5a
