ID,信息源,大类,子类,URL,标题,摘要,发布日期,采集时间,哈希
41432,PR Newswire,投融资与生态,PR新闻通讯社,http://www.prnewswire.com/news-releases/synopsys-showcases-nvidia-partnership-impact-and-ecosystem-innovation-at-gtc-2026-302715123.html,"Mar 16, 2026, 16:30 ETSynopsys Showcases NVIDIA Partnership Impact and Ecosystem Innovation at GTC 2026Synopsys, Inc. (NASDAQ: SNPS) at NVIDIA GTC 2026 is showcasing the progress and impact of its strategic partnership with NVIDIA to revolutionize...","Synopsys, Inc. (NASDAQ: SNPS) at NVIDIA GTC 2026 is showcasing the progress and impact of its strategic partnership with NVIDIA to revolutionize...",,2026-03-22T07:41:59.499848,2d2434a416bf6970558612d1c6d46c1f
41433,PR Newswire,投融资与生态,PR新闻通讯社,https://www.prnewswire.com/news-releases/heavy-industry-manufacturing-latest-news/,"Feb 01, 2024, 06:45 ETInternational Paper Reports Full-Year and Fourth Quarter 2023 Results","MEMPHIS, Tenn., Feb. 1, 2024 /PRNewswire/ -- International Paper (NYSE: IP) today reported full-year and fourth quarter 2023 financial results. FULL-YEAR AND FOURTH QUARTER 2023 HIGHLIGHTS Full-year..",,2026-03-22T07:41:59.499848,326c92d01369ca0d74870790e1fa375b
41439,PR Newswire,投融资与生态,PR新闻通讯社,https://www.prnewswire.com/news-releases/telecommunications-latest-news/,"Feb 25, 2026, 02:00 ETTECNO Unveils the World's Thinnest Modular Smartphone Ecosystem Concept","A new ultra-thin magnetic architecture makes a modular smartphone system possible without added bulk. HONG KONG, Feb. 25, 2026 /PRNewswire/ -- AI-driven innovative technology brand TECNO is set to...",,2026-03-22T07:41:59.499848,95102af8c33d94eef2d61981852689b8
41445,PR Newswire,投融资与生态,PR新闻通讯社,https://www.prnewswire.com/news-releases/consumer-technology-latest-news/,"Feb 25, 2026, 02:00 ETTECNO Unveils the World's Thinnest Modular Smartphone Ecosystem Concept","A new ultra-thin magnetic architecture makes a modular smartphone system possible without added bulk. HONG KONG, Feb. 25, 2026 /PRNewswire/ -- AI-driven innovative technology brand TECNO is set to...",,2026-03-22T07:41:59.499848,3a98df257d1dfd72a2dad0a6f05e4694
41451,PR Newswire,投融资与生态,PR新闻通讯社,https://www.prnewswire.com/news-releases/wybot-devoile-le-s3-et-redefinit-le-nettoyage-autonome-des-piscines-302721449.html,"00:38 ETWYBOT dévoile le S3 et redéfinit le nettoyage autonome des piscinesWYBOT, pionnier de la technologie de nettoyage intelligent des piscines et innovateur mondialement reconnu en matière de solutions robotisées pour...","WYBOT, pionnier de la technologie de nettoyage intelligent des piscines et innovateur mondialement reconnu en matière de solutions robotisées pour...",,2026-03-22T07:41:59.499848,d3d2803c51dea7cf09a1e91fa8955fab
41452,PR Newswire,投融资与生态,PR新闻通讯社,https://www.prnewswire.com/news-releases/wybot-stellt-den-s3-vor-und-setzt-neue-maWstabe-bei-der-automatischen-poolreinigung-302721448.html,"Mar 21, 2026, 23:55 ETWYBOT stellt den S3 vor und setzt neue Maßstäbe bei der automatischen PoolreinigungWYBOT, ein Pionier im Bereich intelligenter Poolreinigungstechnologie und weltweit anerkannter Innovator für robotergestützte Pool-Lösungen, gab...","WYBOT, ein Pionier im Bereich intelligenter Poolreinigungstechnologie und weltweit anerkannter Innovator für robotergestützte Pool-Lösungen, gab...",,2026-03-22T07:41:59.499848,858f126e098942266f98ae60c5b90a40
41453,PR Newswire,投融资与生态,PR新闻通讯社,https://www.prnewswire.com/news-releases/lg-display-becomes-worlds-first-to-mass-produce-1-120hz-laptop-panel-302719732.html,"Mar 21, 2026, 21:00 ETLG Display becomes world's first to mass-produce 1-120Hz laptop panelLG Display, the world's leading innovator of display technologies, today announced that it is beginning the world's first-ever mass production of an...","LG Display, the world's leading innovator of display technologies, today announced that it is beginning the world's first-ever mass production of an...",,2026-03-22T07:41:59.499848,7c71c8a6fa0fc7539bdcff9488418acc
41454,PR Newswire,投融资与生态,PR新闻通讯社,https://www.prnewswire.com/news-releases/hadrian-opens-advanced-manufacturing-facility-in-alabama-to-support-columbia--and-virginia-class-submarine-production-302720156.html,"Mar 21, 2026, 18:27 ET/C O R R E C T I O N -- Hadrian/Hadrian, the advanced manufacturing company, today opened a new facility in Cherokee, Alabama dedicated to the U.S. Navy's Columbia- and...","Hadrian, the advanced manufacturing company, today opened a new facility in Cherokee, Alabama dedicated to the U.S. Navy's Columbia- and...",,2026-03-22T07:41:59.499848,1a377fe9620136c39191dd30a7befbc4
41455,PR Newswire,投融资与生态,PR新闻通讯社,https://www.prnewswire.com/news-releases/medicus-it-appoints-shelby-kobes-as-senior-director-of-nonprofit--community-health-302721415.html,"Mar 21, 2026, 16:55 ETMedicus IT Appoints Shelby Kobes as Senior Director of Nonprofit & Community HealthMedicus IT, a leading IT Managed Services and Cybersecurity provider to healthcare providers, today announced the appointment of Shelby Kobes as...","Medicus IT, a leading IT Managed Services and Cybersecurity provider to healthcare providers, today announced the appointment of Shelby Kobes as...",,2026-03-22T07:41:59.499848,ebe3f0d8914f34a6da24321747dfd947
41456,PR Newswire,投融资与生态,PR新闻通讯社,https://www.prnewswire.com/news-releases/calling-all-builders-dreamers-and-reality-expanders-302721412.html,"Mar 21, 2026, 15:25 ETCALLING ALL BUILDERS, DREAMERS, AND REALITY-EXPANDERSThis is not just another Game Jam. This is your chance to bend reality. Unlikely Collaborators is back with its second annual Game Jam, and this...","This is not just another Game Jam. This is your chance to bend reality. Unlikely Collaborators is back with its second annual Game Jam, and this...",,2026-03-22T07:41:59.499848,6b0bf65b1c8e676ec2918c451d4c49c9
41457,PR Newswire,投融资与生态,PR新闻通讯社,https://www.prnewswire.com/news-releases/sind-hochwertige-proteine-kein-luxus-mehr-auf-der-fic-2026-zeigt-angel-yeast-neue-wege-auf-302721399.html,"Mar 21, 2026, 12:42 ETSind hochwertige Proteine kein Luxus mehr? Auf der FIC 2026 zeigt Angel Yeast neue Wege aufAngel Yeast (SH600298) präsentierte auf der FIC 2026 vom 17. bis 19. März 2026 seine neuesten Erfolge in der Forschung und Entwicklung von...",Angel Yeast (SH600298) präsentierte auf der FIC 2026 vom 17. bis 19. März 2026 seine neuesten Erfolge in der Forschung und Entwicklung von...,,2026-03-22T07:41:59.499848,89a24ab35a78d564260f8dcd7cf4e4be
41458,PR Newswire,投融资与生态,PR新闻通讯社,https://www.prnewswire.com/news-releases/les-proteines-de-qualite-ne-sont-plus-un-luxe--angel-yeast-nous-montre-comment-au-fic-2026-302721398.html,"Mar 21, 2026, 12:38 ETLes protéines de qualité ne sont plus un luxe ? Angel Yeast nous montre comment au FIC 2026Angel Yeast (SH600298) a présenté ses dernières réalisations en matière de R&D sur les protéines de levure et ses progrès dans les applications...",Angel Yeast (SH600298) a présenté ses dernières réalisations en matière de R&D sur les protéines de levure et ses progrès dans les applications...,,2026-03-22T07:41:59.499848,41bb9529e141f886921960b7b785ec5d
41459,PR Newswire,投融资与生态,PR新闻通讯社,https://www.prnewswire.com/news-releases/xgrids-auf-der-nvidia-gtc-2026-real2sim-schlagt-die-brucke-zwischen-realen-raumen-und-physischer-ki-302721395.html,"Mar 21, 2026, 12:10 ETXGRIDS auf der NVIDIA GTC 2026: Real2Sim schlägt die Brücke zwischen realen Räumen und physischer KIDamit Roboter in der realen Welt zuverlässig arbeiten können, müssen sie in Umgebungen trainiert werden, die diese präzise abbilden. Genau das ist...","Damit Roboter in der realen Welt zuverlässig arbeiten können, müssen sie in Umgebungen trainiert werden, die diese präzise abbilden. Genau das ist...",,2026-03-22T07:41:59.499848,049c56053d4a823253db0f9802ec61de
41460,PR Newswire,投融资与生态,PR新闻通讯社,https://www.prnewswire.com/news-releases/spolenost-fractal-ems-ziskala-certifikaty-isoiec-9001-a-27001-302721389.html,"Mar 21, 2026, 11:17 ETSpolečnost Fractal EMS získala certifikáty ISO/IEC 9001 a 27001Společnost Fractal EMS Inc. („Fractal""), vedoucí světový podnik v oblasti systémů pro správu energie a SCADA (systémů pro řízení a sběr dat) pro...","Společnost Fractal EMS Inc. („Fractal""), vedoucí světový podnik v oblasti systémů pro správu energie a SCADA (systémů pro řízení a sběr dat) pro...",,2026-03-22T07:41:59.499848,d0689edb418c60ceec11a8e670498265
41461,PR Newswire,投融资与生态,PR新闻通讯社,https://www.prnewswire.com/news-releases/fractal-ems-recibe-las-certificaciones-isoiec-9001-y-27001-302721388.html,"Mar 21, 2026, 11:13 ETFractal EMS recibe las certificaciones ISO/IEC 9001 y 27001Fractal EMS Inc. (""Fractal""), un líder mundial en sistemas de gestión energética y SCADA para proyectos de almacenamiento de baterías, energía solar, ...","Fractal EMS Inc. (""Fractal""), un líder mundial en sistemas de gestión energética y SCADA para proyectos de almacenamiento de baterías, energía solar, ...",,2026-03-22T07:41:59.499848,521af5d75f588ef7d0b9ed893cf53142
41462,PR Newswire,投融资与生态,PR新闻通讯社,https://www.prnewswire.com/news-releases/fractal-ems---isoiec-9001--27001-302721387.html,"Mar 21, 2026, 11:10 ETFractal EMS получает сертификаты ISO/IEC 9001 и 27001Fractal EMS Inc. («Fractal»), мировой лидер в области систем управления энергопотреблением и SCADA для проектов аккумуляторных батарей, солнечных,...","Fractal EMS Inc. («Fractal»), мировой лидер в области систем управления энергопотреблением и SCADA для проектов аккумуляторных батарей, солнечных,...",,2026-03-22T07:41:59.499848,c291ca5621c269d3e0bc0818a8b79fd1
41463,PR Newswire,投融资与生态,PR新闻通讯社,https://www.prnewswire.com/news-releases/fractal-ems-erhalt-zertifizierungen-nach-iso-9001-und-isoiec-27001-302721386.html,"Mar 21, 2026, 11:06 ETFractal EMS erhält Zertifizierungen nach ISO 9001 und ISO/IEC 27001Fractal EMS Inc. („Fractal""), ein weltweit führendes Unternehmen im Bereich Energiemanagementsysteme und SCADA für Batterie-, Solar-, Hybrid- und...","Fractal EMS Inc. („Fractal""), ein weltweit führendes Unternehmen im Bereich Energiemanagementsysteme und SCADA für Batterie-, Solar-, Hybrid- und...",,2026-03-22T07:41:59.499848,d2792afb35c5c4af304784e5d4d6501b
41464,PR Newswire,投融资与生态,PR新闻通讯社,https://www.prnewswire.com/news-releases/fractal-ems-obtient-les-certifications-isoiec-9001-et-27001-302721384.html,"Mar 21, 2026, 11:03 ETFractal EMS obtient les certifications ISO/IEC 9001 et 27001Fractal EMS Inc. (« Fractal »), un leader mondial des systèmes de gestion de l'énergie et du SCADA pour les projets de stockage sur batterie,...","Fractal EMS Inc. (« Fractal »), un leader mondial des systèmes de gestion de l'énergie et du SCADA pour les projets de stockage sur batterie,...",,2026-03-22T07:41:59.499848,3737c99663374f15102d999e8d9314c0
41465,PR Newswire,投融资与生态,PR新闻通讯社,https://www.prnewswire.com/news-releases/heroad-pinai-novou-eru-hrani-profesionalni-vybaveni-za-nepekonatelnou-cenu-302721375.html,"Mar 21, 2026, 10:22 ETHEROAD přináší novou éru hraní: Profesionální vybavení za nepřekonatelnou cenuSpolečnost QCY s hrdostí oznamuje oficiální uvedení HEROAD, průlomové nové e-sportovní značky zaměřené na redefinování soutěžního prostředí. Značka...","Společnost QCY s hrdostí oznamuje oficiální uvedení HEROAD, průlomové nové e-sportovní značky zaměřené na redefinování soutěžního prostředí. Značka...",,2026-03-22T07:41:59.499848,3f88a7336ba386fcc1bdcef84310eae6
41466,PR Newswire,投融资与生态,PR新闻通讯社,https://www.prnewswire.com/news-releases/ryzobee-announces-root-series-kickstarter-launch-planned-for-q2-2026-bringing-modular-rootmaker-electronics-to-makers-and-3d-printing-creators-in-north-america-and-europe-302719503.html,"Mar 21, 2026, 10:15 ETRyzoBee Announces Root Series Kickstarter Launch Planned for Q2 2026, Bringing Modular RootMaker Electronics to Makers and 3D Printing Creators in North America and EuropeRyzoBee today announced that its Root Series is planned to launch on Kickstarter in Q2 2026 for the North A",RyzoBee today announced that its Root Series is planned to launch on Kickstarter in Q2 2026 for the North American and European markets (timing...,,2026-03-22T07:41:59.499848,c0f7995b39173d919149b0084d6e384f
41467,PR Newswire,投融资与生态,PR新闻通讯社,https://www.prnewswire.com/news-releases/ryzobee-announces-root-series-kickstarter-launch-planned-for-q2-2026-bringing-modular-rootmaker-electronics-to-makers-and-3d-printing-creators-in-north-america-and-europe-302719475.html,"Mar 21, 2026, 10:15 ETRyzoBee Announces Root Series Kickstarter Launch Planned for Q2 2026, Bringing Modular RootMaker Electronics to Makers and 3D Printing Creators in North America and EuropeRyzoBee today announced that its Root Series is planned to launch on Kickstarter in Q2 2026 for the North A",RyzoBee today announced that its Root Series is planned to launch on Kickstarter in Q2 2026 for the North American and European markets (timing...,,2026-03-22T07:41:59.499848,4eee6c4a29e2976624b9cfd990b2f0a5
41468,PR Newswire,投融资与生态,PR新闻通讯社,https://www.prnewswire.com/news-releases/gardepro-launches-worlds-first-3-000ft-1km-long-range-wireless-trail-camera-breaking-wifi-distance-limits-302719435.html,"Mar 21, 2026, 10:00 ETGardePro Launches World's First 3,000ft (1km) Long Range Wireless Trail Camera, Breaking WiFi Distance LimitsGardePro, an innovator in outdoor smart monitoring technology, has launched the GardePro Link 1.0 Long-Range Wireless Trail Camera System (Hub and R3 ...","GardePro, an innovator in outdoor smart monitoring technology, has launched the GardePro Link 1.0 Long-Range Wireless Trail Camera System (Hub and R3 ...",,2026-03-22T07:41:59.499848,4258c5122777acaed347c360ea098bd8
41469,PR Newswire,投融资与生态,PR新闻通讯社,https://www.prnewswire.com/news-releases/wybot-unveils-s3-redefining-hands-free-pool-cleaning-302721368.html,"Mar 21, 2026, 07:54 ETWYBOT Unveils S3, Redefining Hands-Free Pool CleaningWYBOT , a pioneer in intelligent pool cleaning technology and a globally recognized innovator in robotic pool solutions, today announced the upcoming ...","WYBOT , a pioneer in intelligent pool cleaning technology and a globally recognized innovator in robotic pool solutions, today announced the upcoming ...",,2026-03-22T07:41:59.499848,7b6deb23a26179ff86376059801ebca4
41470,PR Newswire,投融资与生态,PR新闻通讯社,https://www.prnewswire.com/news-releases/nordea-bank-abp-managers-transactions--smith-302721367.html,"Mar 21, 2026, 07:47 ETNordea Bank Abp: Managers' transactions - SmithNordea's Chief Financial Officer Ian Smith has received in total 31,063 shares in Nordea Bank Abp according to a notification received under the...","Nordea's Chief Financial Officer Ian Smith has received in total 31,063 shares in Nordea Bank Abp according to a notification received under the...",,2026-03-22T07:41:59.499848,a88b8a47460cd5b828784c1b97cd90e7
41473,PR Newswire,投融资与生态,PR新闻通讯社,https://www.prnewswire.com/news-releases/tcl-ist-ein-macher-die-einbindung-von-esg-schafft-positive-wirkung-entlang-der-globalen-wertschopfungskette-302720324.html,"Mar 20, 2026, 22:23 ETTCL ist ein „Macher"": Die Einbindung von ESG schafft positive Wirkung entlang der globalen WertschöpfungsketteTCL-Gründer und Vorsitzender Li Dongsheng nahm kürzlich an der Interviewreihe „ESG+20 Sustainability Leaders Interview Series"" des United Nations...","TCL-Gründer und Vorsitzender Li Dongsheng nahm kürzlich an der Interviewreihe „ESG+20 Sustainability Leaders Interview Series"" des United Nations...",,2026-03-22T07:41:59.499848,f6c719abdf41651f829220d41282c81f
41474,PR Newswire,投融资与生态,PR新闻通讯社,https://www.prnewswire.com/news-releases/xgrids-en-nvidia-gtc-2026-conectando-espacios-del-mundo-real-e-ia-fisica-a-traves-de-real2sim-302720227.html,"Mar 20, 2026, 17:45 ETXGRIDS en NVIDIA GTC 2026: Conectando espacios del mundo real e IA física a través de Real2SimPara que los robots funcionen de forma fiable en el mundo real, deben entrenarse en entornos que lo representen con precisión. Este es el principal...","Para que los robots funcionen de forma fiable en el mundo real, deben entrenarse en entornos que lo representen con precisión. Este es el principal...",,2026-03-22T07:41:59.499848,fdfe6d9a892b2ed0dad8c96970a6bb12
41475,PR Newswire,投融资与生态,PR新闻通讯社,https://www.prnewswire.com/news-releases/superteam-wheels-stringe-una-partnership-con-il-kbanya-cycling-team-per-lutilizzo-di-ruote-ultra-h2-nelle-gare-uci-continental-302720214.html,"Mar 20, 2026, 17:12 ETSuperteam Wheels stringe una partnership con il Kőbánya Cycling Team per l'utilizzo di ruote Ultra H2 nelle gare UCI ContinentalSuperteam Wheels, uno dei principali produttori cinesi di set di ruote per biciclette in fibra di carbonio, ha annunciato una partnership strategica..","Superteam Wheels, uno dei principali produttori cinesi di set di ruote per biciclette in fibra di carbonio, ha annunciato una partnership strategica...",,2026-03-22T07:41:59.499848,3da87cdf5c75acc9c184466a0446c12a
41476,PR Newswire,投融资与生态,PR新闻通讯社,https://www.prnewswire.com/news-releases/tcl-est-un--faiseur---il-integre-lesg-pour-creer-un-impact-positif-tout-au-long-de-la-chaine-de-valeur-mondiale-302720210.html,"Mar 20, 2026, 16:58 ETTCL est un « faiseur » : il intègre l'ESG pour créer un impact positif tout au long de la chaîne de valeur mondialeLi Dongsheng, fondateur et président de TCL, a récemment participé à la série d'entretiens « ESG+20 Sustainability Leaders » du Pacte mondial des...","Li Dongsheng, fondateur et président de TCL, a récemment participé à la série d'entretiens « ESG+20 Sustainability Leaders » du Pacte mondial des...",,2026-03-22T07:41:59.499848,d183cef683b1a670e75a59de8cae9ac6
41477,PR Newswire,投融资与生态,PR新闻通讯社,https://www.prnewswire.com/news-releases/falltech-introduces-ft-r-srl-r-series-for-faster-confined-space-rescue-302720133.html,"Mar 20, 2026, 15:35 ETFallTech® Introduces FT-R® SRL-R Series for Faster Confined Space RescueFallTech has introduced the FT-R® SRL-R and FT-R® Arc Flash SRL-R, a new generation of self-retracting lifelines designed to improve safety and...","FallTech has introduced the FT-R® SRL-R and FT-R® Arc Flash SRL-R, a new generation of self-retracting lifelines designed to improve safety and...",,2026-03-22T07:41:59.499848,cf626e06fe78b55ef9c4ee2c36e12483
41478,PR Newswire,投融资与生态,PR新闻通讯社,https://www.prnewswire.com/news-releases/honeywell-announces-pricing-of-its-debt-tender-offers-302720051.html,"Mar 20, 2026, 14:30 ETHONEYWELL ANNOUNCES PRICING OF ITS DEBT TENDER OFFERSHoneywell (NASDAQ: HON) today announced the applicable Reference Yield for each series of Securities (as defined below) for its previously announced...",Honeywell (NASDAQ: HON) today announced the applicable Reference Yield for each series of Securities (as defined below) for its previously announced...,,2026-03-22T07:41:59.499848,c2bf8b619dc278e22cbef3252f39ecdf
41479,PR Newswire,投融资与生态,PR新闻通讯社,https://www.prnewswire.com/news-releases/moisture-problems-before-remodeling-explained-by-handyman-expert-tim-ferruzzi-of-greenville-north-carolina-for-hellonation-302720022.html,"Mar 20, 2026, 14:00 ETMoisture Problems Before Remodeling Explained by Handyman Expert Tim Ferruzzi of Greenville, North Carolina for HelloNationHow can homeowners tell if a remodel will uncover a hidden moisture problem in eastern north carolina homes? A HelloNation article provides the...",How can homeowners tell if a remodel will uncover a hidden moisture problem in eastern north carolina homes? A HelloNation article provides the...,,2026-03-22T07:41:59.499848,1466b3a88b23c868fb3ad7118018ae1c
41480,PR Newswire,投融资与生态,PR新闻通讯社,https://www.prnewswire.com/news-releases/in-hellonation-residential-plumbing-expert-tim-martin-shares-diy-tips-for-clogged-drains-302719965.html,"Mar 20, 2026, 13:00 ETIn HelloNation, Residential Plumbing Expert Tim Martin Shares DIY Tips for Clogged DrainsWhat should homeowners try before calling a plumber for a clogged drain? In HelloNation, Tim Martin of Jimmy's Plumbing in Greensboro offers...","What should homeowners try before calling a plumber for a clogged drain? In HelloNation, Tim Martin of Jimmy's Plumbing in Greensboro offers...",,2026-03-22T07:41:59.499848,2b6328167180629a4fde9c2da06d8c54
41481,PR Newswire,投融资与生态,PR新闻通讯社,https://www.prnewswire.com/news-releases/xgrids-a-la-conference-gtc-2026-de-nvidia--relier-les-espaces-du-monde-reel-et-lia-physique-grace-a-lapproche-real2sim-302719998.html,"Mar 20, 2026, 12:51 ETXGRIDS à la conférence GTC 2026 de NVIDIA : relier les espaces du monde réel et l'IA physique grâce à l'approche Real2SimPour que les robots fonctionnent de manière fiable dans le monde réel, ils doivent s'entraîner dans des environnements qui le représentent fidèlement....","Pour que les robots fonctionnent de manière fiable dans le monde réel, ils doivent s'entraîner dans des environnements qui le représentent fidèlement....",,2026-03-22T07:41:59.499848,534ee13ea5f823c7b2b8681e618ec59e
41482,PR Newswire,投融资与生态,PR新闻通讯社,https://www.prnewswire.com/news-releases/in-hellonation-home-building-expert-ren-ferguson-highlights-questions-to-ask-before-choosing-a-home-builder-302719991.html,"Mar 20, 2026, 12:34 ETIn HelloNation, Home Building Expert Ren Ferguson Highlights Questions to Ask Before Choosing a Home BuilderThe article outlines how buyers can evaluate builder credibility, base price details, allowances, and warranty coverage before beginning construction....","The article outlines how buyers can evaluate builder credibility, base price details, allowances, and warranty coverage before beginning construction....",,2026-03-22T07:41:59.499848,c5ecfb06b038573ad4f38e975a948468
41483,PR Newswire,投融资与生态,PR新闻通讯社,https://www.prnewswire.com/news-releases/boma-international-begins-canvassing-process-for-latest-mixed-use-properties-standard-302719844.html,"Mar 20, 2026, 12:30 ETBOMA International Begins Canvassing Process for Latest Mixed-Use Properties StandardBrief History and Explanation: BOMA International has been developing floor measurement standards for more than 100 years and is currently working to ...",Brief History and Explanation: BOMA International has been developing floor measurement standards for more than 100 years and is currently working to ...,,2026-03-22T07:41:59.499848,e02cc37407f4e41b962aaea49f754130
41484,PR Newswire,投融资与生态,PR新闻通讯社,https://www.prnewswire.com/news-releases/tcl-integra-los-criterios-esg-para-generar-un-impacto-positivo-en-toda-la-cadena-de-valor-global-302719978.html,"Mar 20, 2026, 12:14 ETTCL integra los criterios ESG para generar un impacto positivo en toda la cadena de valor globalLi Dongsheng, fundador y presidente de TCL, participó recientemente en la serie de entrevistas ""ESG+20 Sustainability Leaders"" del Pacto Mundial de...","Li Dongsheng, fundador y presidente de TCL, participó recientemente en la serie de entrevistas ""ESG+20 Sustainability Leaders"" del Pacto Mundial de...",,2026-03-22T07:41:59.499848,72a579f8d48997fea3fd913387c1379e
41485,PR Newswire,投融资与生态,PR新闻通讯社,https://www.prnewswire.com/news-releases/orfeo-catala-lent-concert-at-sagrada-familia-commemorates-gaudi-cornerstone-anniversary-302719807.html,"Mar 20, 2026, 11:14 ETOrfeó Català Lent Concert at Sagrada Família Commemorates Gaudí Cornerstone AnniversaryThe Sagrada Família marked a historic milestone on March 19, 2026, with a special Lent concert featuring the renowned Catalan choral society Orfeó...","The Sagrada Família marked a historic milestone on March 19, 2026, with a special Lent concert featuring the renowned Catalan choral society Orfeó...",,2026-03-22T07:41:59.499848,603242b2aab21cd89992a69888725c70
41486,PR Newswire,投融资与生态,PR新闻通讯社,https://www.prnewswire.com/news-releases/mesirow-advises-gravis-a-portfolio-company-of-new-water-capital-lp-on-the-acquisition-of-procon-pacific-302719840.html,"Mar 20, 2026, 11:00 ETMesirow Advises Gravis, a Portfolio Company of New Water Capital, L.P. on the Acquisition of Procon PacificMesirow announced it acted as the exclusive financial advisor to Gravis (""Gravis"" or the ""Company""), a portfolio company of New Water Capital, L.P....","Mesirow announced it acted as the exclusive financial advisor to Gravis (""Gravis"" or the ""Company""), a portfolio company of New Water Capital, L.P....",,2026-03-22T07:41:59.499848,9afb4a72e415744b9f3889675c2cf566
