ID,信息源,大类,子类,URL,标题,摘要,发布日期,采集时间,哈希
7204,PR Newswire,投融资与生态,PR新闻通讯社,https://www.prnewswire.com/news-releases/xinhua-silk-road-dehua-stellt-in-genf-drei-visionen-vor-die-den-kulturellen-austausch-und-die-industrielle-zusammenarbeit-fordern-302700308.html,"Feb 28, 2026, 23:39 ETXinhua Silk Road: Dehua stellt in Genf drei Visionen vor, die den kulturellen Austausch und die industrielle Zusammenarbeit fördernMehr als 30 feine Stücke aus weißem Dehua-Porzellan wurden am 24. Februar im Palais des Nations in Genf vorgestellt und unterstrichen die...",Mehr als 30 feine Stücke aus weißem Dehua-Porzellan wurden am 24. Februar im Palais des Nations in Genf vorgestellt und unterstrichen die...,,2026-03-01T07:37:01.548196,5b5f99fa3bbb09025476b4b998fd00b9
7205,PR Newswire,投融资与生态,PR新闻通讯社,https://www.prnewswire.com/news-releases/athletinnen-aus-schweden-und-den-niederlanden-gewinnen-medaillen-bei-den-olympischen-winterspielen-milano-cortina-2026-und-team-tcl-botschafterin-steht-auf-dem-podium-302700307.html,"Feb 28, 2026, 23:26 ETAthletinnen aus Schweden und den Niederlanden gewinnen Medaillen bei den Olympischen Winterspielen Milano Cortina 2026 und Team TCL-Botschafterin steht auf dem PodiumBei den Olympischen Winterspielen Milano Cortina 2026 sicherten sich Athletinnen aus Schweden und den Niederland","Bei den Olympischen Winterspielen Milano Cortina 2026 sicherten sich Athletinnen aus Schweden und den Niederlanden, die zum Team TCL gehören, mehrere ...",,2026-03-01T07:37:01.548196,1e2baf72760d2a7d16885787001ba51d
7206,PR Newswire,投融资与生态,PR新闻通讯社,https://www.prnewswire.com/news-releases/cgtn-wie-chinas-demokratieweg-die-rechte-und-interessen-der-menschen-schutzt-302700306.html,"Feb 28, 2026, 23:23 ETCGTN: Wie Chinas Demokratieweg die Rechte und Interessen der Menschen schütztDas 2015 von der Kommission für Gesetzgebungsangelegenheiten des Ständigen Ausschusses des Nationalen Volkskongresses (NVK) im Unterbezirk Hongqiao...",Das 2015 von der Kommission für Gesetzgebungsangelegenheiten des Ständigen Ausschusses des Nationalen Volkskongresses (NVK) im Unterbezirk Hongqiao...,,2026-03-01T07:37:01.548196,2d946ad4c1b4fb2787adbe2fd1d34a9f
7207,PR Newswire,投融资与生态,PR新闻通讯社,https://www.prnewswire.com/news-releases/mwc-barcelona-2026-yofc-stellt-hcf-losung-hcf-hollow-core-fiber-oder-hohlkernfaser-vor-die-die-optische-konnektivitat-in-der-ara-der-ki-vorantreibt-302700305.html,"Feb 28, 2026, 23:17 ETMWC Barcelona 2026: YOFC stellt HCF-Lösung (HCF: Hollow-Core Fiber oder Hohlkernfaser) vor, die die optische Konnektivität in der Ära der KI vorantreibtYangtze Optical Fibre and Cable (YOFC) wird auf dem MWC Barcelona 2026, der vom 2. bis 5. März stattfindet, seine neuesten inn","Yangtze Optical Fibre and Cable (YOFC) wird auf dem MWC Barcelona 2026, der vom 2. bis 5. März stattfindet, seine neuesten innovativen optischen...",,2026-03-01T07:37:01.548196,f594b7bcad03243921c157bcbe608ec6
7208,PR Newswire,投融资与生态,PR新闻通讯社,https://www.prnewswire.com/news-releases/tcl-electronics-01070hk-aufnahme-in-den-hang-seng-composite-largecap--midcap-index-und-andere-maWgebliche-indizes-302700292.html,"Feb 28, 2026, 22:06 ETTCL Electronics (01070.HK) Aufnahme in den Hang Seng Composite LargeCap & MidCap Index und andere maßgebliche IndizesTCL Electronics Holdings Limited („TCL Electronics"" oder das „Unternehmen"", 01070. HK) freut sich bekannt zu geben, dass das Unternehmen nach den...","TCL Electronics Holdings Limited („TCL Electronics"" oder das „Unternehmen"", 01070. HK) freut sich bekannt zu geben, dass das Unternehmen nach den...",,2026-03-01T07:37:01.548196,5185bcfcab3200844dfc33e89e137d82
7209,PR Newswire,投融资与生态,PR新闻通讯社,https://www.prnewswire.com/news-releases/tcl-electronics-01070hk-inclus-dans-lindice-hang-seng-composite-largecap--midcap-et-dans-dautres-indices-faisant-autorite-302700291.html,"Feb 28, 2026, 22:05 ETTCL Electronics (01070.HK) inclus dans l'indice Hang Seng Composite LargeCap & MidCap et dans d'autres indices faisant autoritéTCL Electronics Holdings Limited (""TCL Electronics"" ou la ""Société"", 01070.HK) a le plaisir d'annoncer que, suite aux derniers résultats publiés par...","TCL Electronics Holdings Limited (""TCL Electronics"" ou la ""Société"", 01070.HK) a le plaisir d'annoncer que, suite aux derniers résultats publiés par...",,2026-03-01T07:37:01.548196,2dfa212bbafd59b2b1497031725e7038
7210,PR Newswire,投融资与生态,PR新闻通讯社,https://www.prnewswire.com/news-releases/avance-del-mwc-2026--la-ia-de-doogee-redefine-la-exploracion-un-ecosistema-de-escenarios-completos-302699547.html,"Feb 28, 2026, 20:00 ETAvance del MWC 2026 | La IA de DOOGEE redefine la exploración: un ecosistema de escenarios completosCon la llegada del MWC 2026, DOOGEE llega a Barcelona con su nuevo lema: ""DOOGEE AI, Explora más"". Te invitamos a descubrir nuestros nuevos...","Con la llegada del MWC 2026, DOOGEE llega a Barcelona con su nuevo lema: ""DOOGEE AI, Explora más"". Te invitamos a descubrir nuestros nuevos...",,2026-03-01T07:37:01.548196,d0935c9ffbcdc81bab857194d205cff3
7211,PR Newswire,投融资与生态,PR新闻通讯社,https://www.prnewswire.com/news-releases/en-route-vers-le-mwc-2026--doogee-ai-redefinit-lexploration--un-ecosysteme-a-scenario-complet-302700051.html,"Feb 28, 2026, 20:00 ETEn route vers le MWC 2026 | DOOGEE AI redéfinit l'exploration : un écosystème à scénario completÀ l'approche du MWC 2026, DOOGEE se rend à Barcelone avec son nouveau thème : « DOOGEE AI, Explore to More ». Nous vous invitons à découvrir nos...","À l'approche du MWC 2026, DOOGEE se rend à Barcelone avec son nouveau thème : « DOOGEE AI, Explore to More ». Nous vous invitons à découvrir nos...",,2026-03-01T07:37:01.548196,e498448f892dec6e1244b2168fbed46f
7212,PR Newswire,投融资与生态,PR新闻通讯社,https://www.prnewswire.com/news-releases/mwc-2026-vorschau--doogee-ai-definiert-das-entdecken-neu-ein-okosystem-fur-alle-szenarien-302699916.html,"Feb 28, 2026, 20:00 ETMWC 2026 Vorschau | DOOGEE AI definiert das Entdecken neu: Ein Ökosystem für alle SzenarienWährend der MWC 2026 näher rückt, reist DOOGEE mit seinem neuen Motto „DOOGEE AI, Explore to More"" nach Barcelona. Wir laden Sie ein, unsere neuesten ...","Während der MWC 2026 näher rückt, reist DOOGEE mit seinem neuen Motto „DOOGEE AI, Explore to More"" nach Barcelona. Wir laden Sie ein, unsere neuesten ...",,2026-03-01T07:37:01.548196,b62fa783d939bff7049f2f30dab3d79e
7213,PR Newswire,投融资与生态,PR新闻通讯社,https://www.prnewswire.com/news-releases/mwc-2026-preview--doogee-ai-redefines-exploration-a-full-scenario-ecosystem-302699188.html,"Feb 28, 2026, 20:00 ETMWC 2026 Preview | DOOGEE AI Redefines Exploration: A Full-Scenario EcosystemAs MWC 2026 approaches, DOOGEE heads to Barcelona with its new theme: ""DOOGEE AI, Explore to More."" We invite you to experience our newest flagship...","As MWC 2026 approaches, DOOGEE heads to Barcelona with its new theme: ""DOOGEE AI, Explore to More."" We invite you to experience our newest flagship...",,2026-03-01T07:37:01.548196,64eee564f5dd3a2ab22de4834b417d8d
7214,PR Newswire,投融资与生态,PR新闻通讯社,https://www.prnewswire.com/news-releases/mwc-2026-preview--doogee-ai-redefines-exploration-a-full-scenario-ecosystem-302699167.html,"Feb 28, 2026, 20:00 ETMWC 2026 Preview | DOOGEE AI Redefines Exploration: A Full-Scenario EcosystemAs MWC 2026 approaches, DOOGEE heads to Barcelona with its new theme: ""DOOGEE AI, Explore to More."" We invite you to experience our newest flagship...","As MWC 2026 approaches, DOOGEE heads to Barcelona with its new theme: ""DOOGEE AI, Explore to More."" We invite you to experience our newest flagship...",,2026-03-01T07:37:01.548196,51ef2db91b0f5db85807b46733de13d9
7215,PR Newswire,投融资与生态,PR新闻通讯社,https://www.prnewswire.com/news-releases/zkong-predstavuje-na-vetrhu-euroshop-2026-inteligentne-maloobchodne-rieenia-novej-generacie-302700258.html,"Feb 28, 2026, 15:46 ETZKONG predstavuje na veľtrhu EuroShop 2026 inteligentné maloobchodné riešenia novej generácieDÜSSELDORF, Nemecko, 28. február 2026 /PRNewswire/ – Na podujatí EuroShop 2026, poprednej svetovej maloobchodnej výstave, sa spoločnosť ZKONG...","DÜSSELDORF, Nemecko, 28. február 2026 /PRNewswire/ – Na podujatí EuroShop 2026, poprednej svetovej maloobchodnej výstave, sa spoločnosť ZKONG...",,2026-03-01T07:37:01.548196,8cd6701a967315bfc4b75b5c9191457e
7216,PR Newswire,投融资与生态,PR新闻通讯社,https://www.prnewswire.com/news-releases/zoomlion-inicia-2026-con-envios-globales-de-equipos-por-valor-de-1-200-millones-de-dolares-302700266.html,"Feb 28, 2026, 16:04 ETZoomlion inicia 2026 con envíos globales de equipos por valor de 1.200 millones de dólaresZoomlion Heavy Industry Science & Technology Co., Ltd. (""Zoomlion"" o ""la Compañía""; 1157.HK) anunció un sólido inicio de operaciones hasta 2026, con...","Zoomlion Heavy Industry Science & Technology Co., Ltd. (""Zoomlion"" o ""la Compañía""; 1157.HK) anunció un sólido inicio de operaciones hasta 2026, con...",,2026-03-01T07:37:01.548196,b9958ca4d02d727af473c0cbf1746cdd
7217,PR Newswire,投融资与生态,PR新闻通讯社,https://www.prnewswire.com/news-releases/zoomlion-eroffnet-das-jahr-2026-mit-1-2-milliarden-us-dollar-an-maschinenlieferungen-in-alle-welt-302700260.html,"Feb 28, 2026, 15:53 ETZoomlion eröffnet das Jahr 2026 mit 1,2 Milliarden US-Dollar an Maschinenlieferungen in alle WeltZoomlion Heavy Industry Science & Technology Co., Ltd. („Zoomlion"" oder „das Unternehmen""; 1157.HK) gab einen soliden Start in das Jahr 2026 bekannt, ...","Zoomlion Heavy Industry Science & Technology Co., Ltd. („Zoomlion"" oder „das Unternehmen""; 1157.HK) gab einen soliden Start in das Jahr 2026 bekannt, ...",,2026-03-01T07:37:01.548196,5a55f7d88cc076b3a24136a94e60d662
7218,PR Newswire,投融资与生态,PR新闻通讯社,https://www.prnewswire.com/news-releases/zoomlion-ouvre-lannee-2026-avec-1-2-milliard-de-dollars-de-livraisons-dequipements-au-niveau-mondial-302700259.html,"Feb 28, 2026, 15:51 ETZoomlion ouvre l'année 2026 avec 1,2 milliard de dollars de livraisons d'équipements au niveau mondialZoomlion Heavy Industry Science & Technology Co, Ltd. (« Zoomlion » ou « la Société » ; 1157.HK) a annoncé une ouverture solide pour 2026, avec des...","Zoomlion Heavy Industry Science & Technology Co, Ltd. (« Zoomlion » ou « la Société » ; 1157.HK) a annoncé une ouverture solide pour 2026, avec des...",,2026-03-01T07:37:01.548196,d7ff60a2f4a05bf34119e96b1cd01f95
7219,PR Newswire,投融资与生态,PR新闻通讯社,https://www.prnewswire.com/news-releases/orvana-provides-taguas-exploration-update-302700110.html,"Feb 27, 2026, 21:29 ETORVANA PROVIDES TAGUAS EXPLORATION UPDATEATTENDING PDAC 2026 CONVENTION IN TORONTO, MARCH 1-4 EXHIBITING AT BOOTH #2243 TSX:ORV #06-2026 TORONTO, Feb. 27, 2026 /PRNewswire/ - Orvana Minerals ...","ATTENDING PDAC 2026 CONVENTION IN TORONTO, MARCH 1-4 EXHIBITING AT BOOTH #2243 TSX:ORV #06-2026 TORONTO, Feb. 27, 2026 /PRNewswire/ - Orvana Minerals ...",,2026-03-01T07:37:01.548196,ab668c67677f2815c7a7c5a74d1dbb4f
7220,PR Newswire,投融资与生态,PR新闻通讯社,https://www.prnewswire.com/news-releases/declaracion-de-ske-sobre-la-lucha-contra-la-falsificacion-y-la-imitacion-de-productos-de-vapeo-302700104.html,"Feb 27, 2026, 20:57 ETDeclaración de SKE sobre la lucha contra la falsificación y la imitación de productos de vapeoSKE ha identificado recientemente la presencia de productos de vapeo falsificados e imitaciones en el mercado que utilizan ilegalmente el nombre de...",SKE ha identificado recientemente la presencia de productos de vapeo falsificados e imitaciones en el mercado que utilizan ilegalmente el nombre de...,,2026-03-01T07:37:01.548196,e6a43a7586a910571ec25f9ff1fb754f
7221,PR Newswire,投融资与生态,PR新闻通讯社,https://www.prnewswire.com/news-releases/declaration-du-ske-sur-la-lutte-contre-les-contrefacons-et-les-imitations-de-produits-de-vapotage-302700106.html,"Feb 27, 2026, 20:57 ETDéclaration du SKE sur la lutte contre les contrefaçons et les imitations de produits de vapotageSKE a récemment identifié la présence de contrefaçons et d'imitations de produits de vapotage sur le marché qui utilisent illégalement le nom de la...",SKE a récemment identifié la présence de contrefaçons et d'imitations de produits de vapotage sur le marché qui utilisent illégalement le nom de la...,,2026-03-01T07:37:01.548196,8346377a80ca206a9c4caa67a75fd74e
7222,PR Newswire,投融资与生态,PR新闻通讯社,https://www.prnewswire.com/news-releases/ske-stellungnahme-zur-bekampfung-von-gefalschten-und-nachgemachten-vaping-produkten-302700105.html,"Feb 27, 2026, 20:57 ETSKE-Stellungnahme zur Bekämpfung von gefälschten und nachgemachten Vaping-ProduktenSKE hat kürzlich das Vorhandensein von gefälschten und nachgeahmten Vaping-Produkten auf dem Markt festgestellt, die den Markennamen, die...","SKE hat kürzlich das Vorhandensein von gefälschten und nachgeahmten Vaping-Produkten auf dem Markt festgestellt, die den Markennamen, die...",,2026-03-01T07:37:01.548196,3254c7be70498cb51cc27efadbaa3a61
7223,PR Newswire,投融资与生态,PR新闻通讯社,https://www.prnewswire.com/news-releases/goldmining-announces-filing-of-financial-statements-mda-annual-information-form-and-annual-report-on-form-40-f-302700098.html,"Feb 27, 2026, 20:39 ETGoldMining Announces Filing of Financial Statements, MD&A, Annual Information Form and Annual Report on Form 40-FVANCOUVER, BC, Feb. 27, 2026 /PRNewswire/ - GoldMining Inc. (TSX: GOLD) (NYSE American: GLDG) (""GoldMining"" or the ""Company"") announces the filing of ...","VANCOUVER, BC, Feb. 27, 2026 /PRNewswire/ - GoldMining Inc. (TSX: GOLD) (NYSE American: GLDG) (""GoldMining"" or the ""Company"") announces the filing of ...",,2026-03-01T07:37:01.548196,78149fc3a545b408a2928c1cfe010a58
7224,PR Newswire,投融资与生态,PR新闻通讯社,https://www.prnewswire.com/news-releases/agribank-reports-fourth-quarter-2025-and-year-end-financial-results-302700096.html,"Feb 27, 2026, 20:32 ETAgriBank Reports Fourth Quarter 2025 and Year-End Financial ResultsToday, St. Paul-based AgriBank announced financial results for the fourth quarter and full year of 2025, with strong profitability, credit quality,...","Today, St. Paul-based AgriBank announced financial results for the fourth quarter and full year of 2025, with strong profitability, credit quality,...",,2026-03-01T07:37:01.548196,b4790ad74d5029f2fb03e73c18e53bf1
7225,PR Newswire,投融资与生态,PR新闻通讯社,https://www.prnewswire.com/news-releases/fmc-corporation-declares-quarterly-dividend-302699876.html,"Feb 27, 2026, 17:00 ETFMC Corporation Declares Quarterly DividendFMC Corporation (NYSE: FMC) announced today that its board of directors declared a regular quarterly dividend of 8 cents per share, payable on April...","FMC Corporation (NYSE: FMC) announced today that its board of directors declared a regular quarterly dividend of 8 cents per share, payable on April...",,2026-03-01T07:37:01.548196,6b0d49d35b910d8715f8a82684d8207d
7226,PR Newswire,投融资与生态,PR新闻通讯社,https://www.prnewswire.com/news-releases/quaker-houghton-announces-quarterly-dividend-302699879.html,"Feb 27, 2026, 16:30 ETQuaker Houghton Announces Quarterly DividendThe Board of Directors of Quaker Houghton (NYSE: KWR) today declared a quarterly cash dividend of $0.508 per share, payable on April 30, 2026, to...","The Board of Directors of Quaker Houghton (NYSE: KWR) today declared a quarterly cash dividend of $0.508 per share, payable on April 30, 2026, to...",,2026-03-01T07:37:01.548196,f4a6be5a56a32bfae700467cd9a64b03
7227,PR Newswire,投融资与生态,PR新闻通讯社,https://www.prnewswire.com/news-releases/fmc-corporation-announces-election-of-michael-f-barry-to-board-of-directors-302699884.html,"Feb 27, 2026, 16:30 ETFMC Corporation Announces Election of Michael F. Barry to Board of DirectorsFMC Corporation (NYSE: FMC), a leading global agricultural sciences company, today announced the election of Michael F. Barry to the company's Board...","FMC Corporation (NYSE: FMC), a leading global agricultural sciences company, today announced the election of Michael F. Barry to the company's Board...",,2026-03-01T07:37:01.548196,412a6d26aed8a42581174bee88c258a8
7228,PR Newswire,投融资与生态,PR新闻通讯社,https://www.prnewswire.com/news-releases/crown-holdings-inc-announces-35-dividend-increase-302699868.html,"Feb 27, 2026, 16:05 ETCROWN HOLDINGS, INC. ANNOUNCES 35% DIVIDEND INCREASECrown Holdings, Inc. (NYSE: CCK) announced today that its Board of Directors declared a cash dividend of $0.35 per share, payable March 31, 2026, to...","Crown Holdings, Inc. (NYSE: CCK) announced today that its Board of Directors declared a cash dividend of $0.35 per share, payable March 31, 2026, to...",,2026-03-01T07:37:01.548196,d2fd4ef3075e7c60edbd12ac3406ec8e
7229,PR Newswire,投融资与生态,PR新闻通讯社,https://www.prnewswire.com/news-releases/blue-moon-to-acquire-the-apex-germanium-and-gallium-mine-from-teck-to-advance-us-critical-mineral-projects-to-secure-north-american-supply-302699965.html,"Feb 27, 2026, 16:05 ETBlue Moon to Acquire the Apex Germanium and Gallium Mine from Teck to Advance US Critical Mineral Projects to Secure North American SupplyTORONTO, Feb. 27, 2026 /PRNewswire/ - Blue Moon Metals Inc. (""Blue Moon"" or the ""Company"") (TSXV: MOON) (NASDAQ: BMM) is pleased to announce","TORONTO, Feb. 27, 2026 /PRNewswire/ - Blue Moon Metals Inc. (""Blue Moon"" or the ""Company"") (TSXV: MOON) (NASDAQ: BMM) is pleased to announce that...",,2026-03-01T07:37:01.548196,f1d570a28f127c889b1048b731708bad
7230,PR Newswire,投融资与生态,PR新闻通讯社,https://www.prnewswire.com/news-releases/burnham-holdings-announces-court-supervised-restructuring-for-crown-boiler-company-subsidiary-302699924.html,"Feb 27, 2026, 15:08 ETBurnham Holdings Announces Court-Supervised Restructuring for Crown Boiler Company SubsidiaryBurnham Holdings, Inc. (OTC-Pink: BURCA) (""BHI"", the ""Company"", ""we"" or ""our""), the parent company to leading manufacturers of boilers, furnaces and...","Burnham Holdings, Inc. (OTC-Pink: BURCA) (""BHI"", the ""Company"", ""we"" or ""our""), the parent company to leading manufacturers of boilers, furnaces and...",,2026-03-01T07:37:01.548196,3bfc1bc6281236e5ce67c628cbeb8917
7231,PR Newswire,投融资与生态,PR新闻通讯社,https://www.prnewswire.com/news-releases/mitsubishi-logisnext-americas-appoints-darr-equipment-co-as-an-authorized-dealer-in-arizona-302699923.html,"Feb 27, 2026, 15:07 ETMitsubishi Logisnext Americas Appoints Darr Equipment Co. As An Authorized Dealer in ArizonaMitsubishi Logisnext Americas, one of the world's leading manufacturers and providers of material handling, automation, and fleet solutions, today...","Mitsubishi Logisnext Americas, one of the world's leading manufacturers and providers of material handling, automation, and fleet solutions, today...",,2026-03-01T07:37:01.548196,1c862cc82b77f09ae2cb5d37effa9a10
7232,PR Newswire,投融资与生态,PR新闻通讯社,https://www.prnewswire.com/news-releases/angetrieben-durch-physische-ki-envision-setzt-segel-mit-der-weltweit-ersten-kommerziellen-ladung-grunen-ammoniaks-nach-sudkorea-302699908.html,"Feb 27, 2026, 14:52 ETAngetrieben durch physische KI: Envision setzt Segel mit der weltweit ersten kommerziellen Ladung grünen Ammoniaks nach SüdkoreaEnvision, ein weltweit führendes Unternehmen für grüne Technologien, hat die weltweit erste Lieferung von grünem Ammoniak von Chifeng in der Inneren..","Envision, ein weltweit führendes Unternehmen für grüne Technologien, hat die weltweit erste Lieferung von grünem Ammoniak von Chifeng in der Inneren...",,2026-03-01T07:37:01.548196,d446bd80efc26f1f8405a1767ef8df84
7233,PR Newswire,投融资与生态,PR新闻通讯社,https://www.prnewswire.com/news-releases/veteran-owned-perezdiaz-llc-achieves-c3pao-authorization-joins-fewer-than-100-authorized-assessment-bodies-serving-80-000-defense-contractors-302699875.html,"Feb 27, 2026, 13:56 ETVeteran-Owned Perezdiaz, LLC Achieves C3PAO Authorization, Joins Fewer Than 100 Authorized Assessment Bodies Serving 80,000+ Defense ContractorsPerezdiaz Federal, the independent assessment division of Perezdiaz, LLC, today announced its authorization as a CMMC Third-Party Asse","Perezdiaz Federal, the independent assessment division of Perezdiaz, LLC, today announced its authorization as a CMMC Third-Party Assessment...",,2026-03-01T07:37:01.548196,efb6f6a09ace28d040734c2f38707272
7234,PR Newswire,投融资与生态,PR新闻通讯社,https://www.prnewswire.com/news-releases/an-inventhelp-123invent-client-develops-new-overspray-and-dust-containment-system-mtk-103-302698155.html,"Feb 27, 2026, 11:45 ETAn InventHelp 123Invent Client Develops New Overspray and Dust Containment System (MTK-103)""As a construction worker, I wanted to create a folding device that would offer an improved way to contain overspray related to airless paint...","""As a construction worker, I wanted to create a folding device that would offer an improved way to contain overspray related to airless paint...",,2026-03-01T07:37:01.548196,2b2c5540341867b2451c28936738bac3
7235,PR Newswire,投融资与生态,PR新闻通讯社,https://www.prnewswire.com/news-releases/industrial-silver-demand-is-rewriting-the-supply-equation-explorers-are-racing-to-fill-the-gap-302699776.html,"Feb 27, 2026, 11:43 ETIndustrial Silver Demand Is Rewriting the Supply Equation, Explorers Are Racing to Fill the GapIndustrial silver fabrication accounts for nearly 60% of total global demand, with industrial use reaching 680 million ounces in 2024 as solar...","Industrial silver fabrication accounts for nearly 60% of total global demand, with industrial use reaching 680 million ounces in 2024 as solar...",,2026-03-01T07:37:01.548196,2ea9c6e5ac7cd0180739ec72bee37b3b
7247,PR Newswire,投融资与生态,PR新闻通讯社,https://www.prnewswire.com/news-releases/huaweis-superpod-portfolio-creates-new-option-for-global-computing-at-mwc-barcelona-2026-302700245.html,"Feb 28, 2026, 15:12 ETHuawei's SuperPoD Portfolio Creates New Option for Global Computing at MWC Barcelona 2026At MWC Barcelona 2026, Huawei debuts its latest SuperPoD product Atlas 950 SuperPoD,TaiShan 950 SuperPoD and a series of computing solutions to the...","At MWC Barcelona 2026, Huawei debuts its latest SuperPoD product Atlas 950 SuperPoD,TaiShan 950 SuperPoD and a series of computing solutions to the...",,2026-03-01T07:37:01.548196,484af6cb8a5e5f2e702404844f47bc1b
7248,PR Newswire,投融资与生态,PR新闻通讯社,https://www.prnewswire.com/news-releases/mwc-barcelona-2026-yofc-to-unveil-hollow-core-fibre-hcf-solution-advancing-optical-connectivity-in-the-era-of-ai-302700201.html,"Feb 28, 2026, 11:27 ETMWC Barcelona 2026: YOFC to Unveil Hollow-Core Fibre (HCF) Solution, Advancing Optical Connectivity in the Era of AIYangtze Optical Fibre and Cable (YOFC) will showcase its latest innovative optical connectivity solutions for the AI era at MWC Barcelona 2026,...","Yangtze Optical Fibre and Cable (YOFC) will showcase its latest innovative optical connectivity solutions for the AI era at MWC Barcelona 2026,...",,2026-03-01T07:37:01.548196,825806196b74d20d44fadda512c7dad7
7249,PR Newswire,投融资与生态,PR新闻通讯社,https://www.prnewswire.com/news-releases/mwc-barcelona-2026-yofc-to-unveil-hollow-core-fibre-hcf-solution-advancing-optical-connectivity-in-the-era-of-ai-302700133.html,"Feb 28, 2026, 00:15 ETMWC Barcelona 2026: YOFC to Unveil Hollow-Core Fibre (HCF) Solution, Advancing Optical Connectivity in the Era of AIYangtze Optical Fibre and Cable (YOFC) will showcase its latest innovative optical connectivity solutions for the AI era at MWC Barcelona 2026,...","Yangtze Optical Fibre and Cable (YOFC) will showcase its latest innovative optical connectivity solutions for the AI era at MWC Barcelona 2026,...",,2026-03-01T07:37:01.548196,05005509be0ac3f85b470eb28bca5332
7250,PR Newswire,投融资与生态,PR新闻通讯社,https://www.prnewswire.com/news-releases/hcltech-wird-auf-dem-mwc-2026-den-dialog-uber-die-ki-gestutzte-zukunft-der-telekommunikationsbranche-vorantreiben-302699989.html,"Feb 27, 2026, 16:20 ETHCLTech wird auf dem MWC 2026 den Dialog über die KI-gestützte Zukunft der Telekommunikationsbranche vorantreibenHCLTech, (NSE: HCLTECH) (BSE: HCLTECH) , ein führendes globales Technologieunternehmen, wird auf dem Mobile World Congress Barcelona 2026 zeigen, wie ...","HCLTech, (NSE: HCLTECH) (BSE: HCLTECH) , ein führendes globales Technologieunternehmen, wird auf dem Mobile World Congress Barcelona 2026 zeigen, wie ...",,2026-03-01T07:37:01.548196,49be467b386b83a7f27fd7ef769863cd
7251,PR Newswire,投融资与生态,PR新闻通讯社,https://www.prnewswire.com/news-releases/real-time-data-gaps-are-hindering-ai-scale-in-banking-finds-info-tech-research-group-302699974.html,"Feb 27, 2026, 16:11 ETReal-Time Data Gaps Are Hindering AI Scale in Banking, Finds Info-Tech Research GroupThe banking industry is accelerating AI initiatives in fraud detection, personalization, and risk analytics, yet many institutions are confronting...","The banking industry is accelerating AI initiatives in fraud detection, personalization, and risk analytics, yet many institutions are confronting...",,2026-03-01T07:37:01.548196,d9bb37b209a38624bb11500bf626a837
